[32m[I 2026-08-23 01:17:43,481][0m Trial 39 finished with values: [0.22192377056219634, 0.6990137601866966] and parameters: {'top_n': 28, 'n_estimators': 400, 'max_depth': 8, 'min_samples_leaf': 32, 'split_leaf_multiplier': 3, 'max_features': 0.25}.[0m
[reduced trial 040] N=23 RMST=1.1555 C=0.7063 params={'n_estimators': 600, 'max_depth': 6, 'min_samples_leaf': 16, 'min_samples_split': 32, 'max_features': 'sqrt'}
[32m[I 2026-08-23 01:17:46,092][0m Trial 40 finished with values: [1.1554573363181266, 0.7063128037388978] and parameters: {'top_n': 23, 'n_estimators': 600, 'max_depth': 6, 'min_samples_leaf': 16, 'split_leaf_multiplier': 2, 'max_features': 'sqrt'}.[0m
[reduced trial 041] N=21 RMST=3.0094 C=0.7088 params={'n_estimators': 400, 'max_depth': 8, 'min_samples_leaf': 16, 'min_samples_split': 48, 'max_features': 'sqrt'}
[32m[I 2026-08-23 01:17:48,067][0m Trial 41 finished with values: [3.009420916231853, 0.7087675416002036] and parameters: {'top_n': 21, 'n_estimators': 400, 'max_depth': 8, 'min_samples_leaf': 16, 'split_leaf_multiplier': 3, 'max_features': 'sqrt'}.[0m
[reduced trial 042] N=24 RMST=-0.1020 C=0.7039 params={'n_estimators': 200, 'max_depth': 6, 'min_samples_leaf': 16, 'min_samples_split': 48, 'max_features': 'sqrt'}
[32m[I 2026-08-23 01:17:49,226][0m Trial 42 finished with values: [-0.10203581564079842, 0.7038984092305591] and parameters: {'top_n': 24, 'n_estimators': 200, 'max_depth': 6, 'min_samples_leaf': 16, 'split_leaf_multiplier': 3, 'max_features': 'sqrt'}.[0m
[reduced trial 043] N=27 RMST=0.1200 C=0.7053 params={'n_estimators': 400, 'max_depth': 4, 'min_samples_leaf': 16, 'min_samples_split': 32, 'max_features': 'log2'}
[32m[I 2026-08-23 01:17:50,989][0m Trial 43 finished with values: [0.11997937317318233, 0.7052855999056586] and parameters: {'top_n': 27, 'n_estimators': 400, 'max_depth': 4, 'min_samples_leaf': 16, 'split_leaf_multiplier': 2, 'max_features': 'log2'}.[0m
[reduced trial 044] N=14 RMST=1.7644 C=0.7038 params={'n_estimators': 200, 'max_depth': 6, 'min_samples_leaf': 8, 'min_samples_split': 24, 'max_features': 'sqrt'}
[32m[I 2026-08-23 01:17:51,986][0m Trial 44 finished with values: [1.764397856806324, 0.7037742758368143] and parameters: {'top_n': 14, 'n_estimators': 200, 'max_depth': 6, 'min_samples_leaf': 8, 'split_leaf_multiplier': 3, 'max_features': 'sqrt'}.[0m
[reduced trial 045] N=32 RMST=1.4933 C=0.7100 params={'n_estimators': 600, 'max_depth': 4, 'min_samples_leaf': 8, 'min_samples_split': 16, 'max_features': 'sqrt'}
[32m[I 2026-08-23 01:17:54,985][0m Trial 45 finished with values: [1.4933152450198963, 0.7099995655331219] and parameters: {'top_n': 32, 'n_estimators': 600, 'max_depth': 4, 'min_samples_leaf': 8, 'split_leaf_multiplier': 2, 'max_features': 'sqrt'}.[0m
[reduced trial 046] N=27 RMST=1.3585 C=0.7042 params={'n_estimators': 600, 'max_depth': 4, 'min_samples_leaf': 16, 'min_samples_split': 32, 'max_features': 0.25}
[32m[I 2026-08-23 01:17:58,631][0m Trial 46 finished with values: [1.358455440312497, 0.7041746060316416] and parameters: {'top_n': 27, 'n_estimators': 600, 'max_depth': 4, 'min_samples_leaf': 16, 'split_leaf_multiplier': 2, 'max_features': 0.25}.[0m
[reduced trial 047] N=22 RMST=-0.1184 C=0.7090 params={'n_estimators': 600, 'max_depth': 8, 'min_samples_leaf': 16, 'min_samples_split': 48, 'max_features': 'log2'}
[32m[I 2026-08-23 01:18:01,149][0m Trial 47 finished with values: [-0.11844594765832565, 0.7089537416908209] and parameters: {'top_n': 22, 'n_estimators': 600, 'max_depth': 8, 'min_samples_leaf': 16, 'split_leaf_multiplier': 3, 'max_features': 'log2'}.[0m
[reduced trial 048] N=00 RMST=5.4684 C=0.6845 params={'n_estimators': 200, 'max_depth': 8, 'min_samples_leaf': 8, 'min_samples_split': 24, 'max_features': 0.25}
