[32m[I 2026-08-22 23:23:24,714][0m A new study created in memory with name: no-name-09ddc183-b51c-49bd-9051-affe9e2498d6[0m
[screening trial 000] RMST=0.2219 C=0.6623 params={'n_estimators': 250, 'max_depth': 4, 'min_samples_leaf': 16, 'min_samples_split': 32, 'max_features': 0.25}
[32m[I 2026-08-22 23:28:46,176][0m Trial 0 finished with values: [0.22192377056219634, 0.662343204007026] and parameters: {'n_estimators': 250, 'max_depth': 4, 'min_samples_leaf': 16, 'split_leaf_multiplier': 2, 'max_features': 0.25}.[0m
[screening trial 001] RMST=0.2219 C=0.6641 params={'n_estimators': 250, 'max_depth': 6, 'min_samples_leaf': 16, 'min_samples_split': 32, 'max_features': 0.5}
[32m[I 2026-08-22 23:42:30,666][0m Trial 1 finished with values: [0.22192377056219634, 0.6640950365262511] and parameters: {'n_estimators': 250, 'max_depth': 6, 'min_samples_leaf': 16, 'split_leaf_multiplier': 2, 'max_features': 0.5}.[0m
[screening trial 002] RMST=0.2219 C=0.6654 params={'n_estimators': 150, 'max_depth': 6, 'min_samples_leaf': 16, 'min_samples_split': 32, 'max_features': 0.5}
[32m[I 2026-08-22 23:50:52,896][0m Trial 2 finished with values: [0.22192377056219634, 0.6654139538347909] and parameters: {'n_estimators': 150, 'max_depth': 6, 'min_samples_leaf': 16, 'split_leaf_multiplier': 2, 'max_features': 0.5}.[0m
[screening trial 003] RMST=0.2219 C=0.6663 params={'n_estimators': 150, 'max_depth': 4, 'min_samples_leaf': 16, 'min_samples_split': 32, 'max_features': 0.5}
[32m[I 2026-08-22 23:57:13,360][0m Trial 3 finished with values: [0.22192377056219634, 0.6662642675819436] and parameters: {'n_estimators': 150, 'max_depth': 4, 'min_samples_leaf': 16, 'split_leaf_multiplier': 2, 'max_features': 0.5}.[0m
[screening trial 004] RMST=0.2219 C=0.6588 params={'n_estimators': 250, 'max_depth': 6, 'min_samples_leaf': 16, 'min_samples_split': 32, 'max_features': 0.25}
[32m[I 2026-08-23 00:03:58,052][0m Trial 4 finished with values: [0.22192377056219634, 0.6587805756065468] and parameters: {'n_estimators': 250, 'max_depth': 6, 'min_samples_leaf': 16, 'split_leaf_multiplier': 2, 'max_features': 0.25}.[0m
[screening trial 005] RMST=0.2219 C=0.6597 params={'n_estimators': 150, 'max_depth': 6, 'min_samples_leaf': 16, 'min_samples_split': 32, 'max_features': 0.25}
[32m[I 2026-08-23 00:08:08,729][0m Trial 5 finished with values: [0.22192377056219634, 0.6596619227021358] and parameters: {'n_estimators': 150, 'max_depth': 6, 'min_samples_leaf': 16, 'split_leaf_multiplier': 2, 'max_features': 0.25}.[0m
[screening trial 006] RMST=0.2219 C=0.6663 params={'n_estimators': 150, 'max_depth': 4, 'min_samples_leaf': 16, 'min_samples_split': 32, 'max_features': 0.5}
[32m[I 2026-08-23 00:14:35,911][0m Trial 6 finished with values: [0.22192377056219634, 0.6662642675819436] and parameters: {'n_estimators': 150, 'max_depth': 4, 'min_samples_leaf': 16, 'split_leaf_multiplier': 2, 'max_features': 0.5}.[0m
[screening trial 007] RMST=0.2219 C=0.6641 params={'n_estimators': 250, 'max_depth': 6, 'min_samples_leaf': 16, 'min_samples_split': 32, 'max_features': 0.5}
[32m[I 2026-08-23 00:28:18,887][0m Trial 7 finished with values: [0.22192377056219634, 0.6640950365262511] and parameters: {'n_estimators': 250, 'max_depth': 6, 'min_samples_leaf': 16, 'split_leaf_multiplier': 2, 'max_features': 0.5}.[0m
[screening trial 008] RMST=0.2219 C=0.6652 params={'n_estimators': 150, 'max_depth': 4, 'min_samples_leaf': 16, 'min_samples_split': 32, 'max_features': 0.25}
[32m[I 2026-08-23 00:31:27,566][0m Trial 8 finished with values: [0.22192377056219634, 0.6652417187509698] and parameters: {'n_estimators': 150, 'max_depth': 4, 'min_samples_leaf': 16, 'split_leaf_multiplier': 2, 'max_features': 0.25}.[0m
[screening trial 009] RMST=0.2219 C=0.6641 params={'n_estimators': 250, 'max_depth': 6, 'min_samples_leaf': 16, 'min_samples_split': 32, 'max_features': 0.5}
[32m[I 2026-08-23 00:45:09,449][0m Trial 9 finished with values: [0.22192377056219634, 0.6640950365262511] and parameters: {'n_estimators': 250, 'max_depth': 6, 'min_samples_leaf': 16, 'split_leaf_multiplier': 2, 'max_features': 0.5}.[0m
[screening trial 010] RMST=0.2219 C=0.6663 params={'n_estimators': 150, 'max_depth': 4, 'min_samples_leaf': 16, 'min_samples_split': 32, 'max_features': 0.5}
[32m[I 2026-08-23 00:51:29,622][0m Trial 10 finished with values: [0.22192377056219634, 0.6662642675819436] and parameters: {'n_estimators': 150, 'max_depth': 4, 'min_samples_leaf': 16, 'split_leaf_multiplier': 2, 'max_features': 0.5}.[0m
[screening trial 011] RMST=0.2219 C=0.6588 params={'n_estimators': 250, 'max_depth': 6, 'min_samples_leaf': 16, 'min_samples_split': 32, 'max_features': 0.25}
[32m[I 2026-08-23 00:58:10,833][0m Trial 11 finished with values: [0.22192377056219634, 0.6587805756065468] and parameters: {'n_estimators': 250, 'max_depth': 6, 'min_samples_leaf': 16, 'split_leaf_multiplier': 2, 'max_features': 0.25}.[0m
[PFI fold 1] 626/8666 features used by a split
[PFI fold 2] 673/8666 features used by a split
[PFI fold 2] processed through feature 1000
[PFI fold 2] processed through feature 1250
[PFI fold 3] 628/8666 features used by a split
[PFI fold 3] processed through feature 3500
[PFI fold 3] processed through feature 4250
[PFI fold 3] processed through feature 8250
[32m[I 2026-08-23 01:16:20,968][0m A new study created in memory with name: no-name-8e22e158-fb51-47d6-99a6-5b28ed40a40e[0m
[reduced trial 000] N=00 RMST=1.8875 C=0.6823 params={'n_estimators': 600, 'max_depth': 6, 'min_samples_leaf': 16, 'min_samples_split': 32, 'max_features': 'sqrt'}
[32m[I 2026-08-23 01:16:22,302][0m Trial 0 finished with values: [1.887541866214531, 0.6822883370469907] and parameters: {'top_n': 0, 'n_estimators': 600, 'max_depth': 6, 'min_samples_leaf': 16, 'split_leaf_multiplier': 2, 'max_features': 'sqrt'}.[0m
[reduced trial 001] N=01 RMST=3.4077 C=0.6944 params={'n_estimators': 600, 'max_depth': 6, 'min_samples_leaf': 16, 'min_samples_split': 32, 'max_features': 'sqrt'}
[32m[I 2026-08-23 01:16:23,683][0m Trial 1 finished with values: [3.4077425555616596, 0.6943913429371202] and parameters: {'top_n': 1, 'n_estimators': 600, 'max_depth': 6, 'min_samples_leaf': 16, 'split_leaf_multiplier': 2, 'max_features': 'sqrt'}.[0m
[reduced trial 002] N=02 RMST=3.8256 C=0.7036 params={'n_estimators': 600, 'max_depth': 6, 'min_samples_leaf': 16, 'min_samples_split': 32, 'max_features': 'sqrt'}
[32m[I 2026-08-23 01:16:25,178][0m Trial 2 finished with values: [3.825563287338599, 0.7035663524022915] and parameters: {'top_n': 2, 'n_estimators': 600, 'max_depth': 6, 'min_samples_leaf': 16, 'split_leaf_multiplier': 2, 'max_features': 'sqrt'}.[0m
[reduced trial 003] N=03 RMST=1.9980 C=0.7065 params={'n_estimators': 600, 'max_depth': 6, 'min_samples_leaf': 16, 'min_samples_split': 32, 'max_features': 'sqrt'}
[32m[I 2026-08-23 01:16:26,659][0m Trial 3 finished with values: [1.9979564208178973, 0.7065269338431078] and parameters: {'top_n': 3, 'n_estimators': 600, 'max_depth': 6, 'min_samples_leaf': 16, 'split_leaf_multiplier': 2, 'max_features': 'sqrt'}.[0m
[reduced trial 004] N=04 RMST=1.9216 C=0.7084 params={'n_estimators': 600, 'max_depth': 6, 'min_samples_leaf': 16, 'min_samples_split': 32, 'max_features': 'sqrt'}
[32m[I 2026-08-23 01:16:28,150][0m Trial 4 finished with values: [1.9215657667749577, 0.7084199680977178] and parameters: {'top_n': 4, 'n_estimators': 600, 'max_depth': 6, 'min_samples_leaf': 16, 'split_leaf_multiplier': 2, 'max_features': 'sqrt'}.[0m
[reduced trial 005] N=05 RMST=0.4019 C=0.7102 params={'n_estimators': 600, 'max_depth': 6, 'min_samples_leaf': 16, 'min_samples_split': 32, 'max_features': 'sqrt'}
[32m[I 2026-08-23 01:16:29,679][0m Trial 5 finished with values: [0.4018745112153677, 0.7102105923024883] and parameters: {'top_n': 5, 'n_estimators': 600, 'max_depth': 6, 'min_samples_leaf': 16, 'split_leaf_multiplier': 2, 'max_features': 'sqrt'}.[0m
[reduced trial 006] N=06 RMST=4.2630 C=0.7050 params={'n_estimators': 600, 'max_depth': 6, 'min_samples_leaf': 16, 'min_samples_split': 32, 'max_features': 'sqrt'}
[32m[I 2026-08-23 01:16:31,351][0m Trial 6 finished with values: [4.263014787604153, 0.7049783697561399] and parameters: {'top_n': 6, 'n_estimators': 600, 'max_depth': 6, 'min_samples_leaf': 16, 'split_leaf_multiplier': 2, 'max_features': 'sqrt'}.[0m
[reduced trial 007] N=07 RMST=0.7262 C=0.7052 params={'n_estimators': 600, 'max_depth': 6, 'min_samples_leaf': 16, 'min_samples_split': 32, 'max_features': 'sqrt'}
[32m[I 2026-08-23 01:16:33,089][0m Trial 7 finished with values: [0.7262447729064243, 0.7052297398784734] and parameters: {'top_n': 7, 'n_estimators': 600, 'max_depth': 6, 'min_samples_leaf': 16, 'split_leaf_multiplier': 2, 'max_features': 'sqrt'}.[0m
[reduced trial 008] N=08 RMST=1.0801 C=0.7063 params={'n_estimators': 600, 'max_depth': 6, 'min_samples_leaf': 16, 'min_samples_split': 32, 'max_features': 'sqrt'}
[32m[I 2026-08-23 01:16:34,861][0m Trial 8 finished with values: [1.08011272943439, 0.7063221137434287] and parameters: {'top_n': 8, 'n_estimators': 600, 'max_depth': 6, 'min_samples_leaf': 16, 'split_leaf_multiplier': 2, 'max_features': 'sqrt'}.[0m
[reduced trial 009] N=09 RMST=1.2942 C=0.7043 params={'n_estimators': 600, 'max_depth': 6, 'min_samples_leaf': 16, 'min_samples_split': 32, 'max_features': 'sqrt'}
[32m[I 2026-08-23 01:16:36,678][0m Trial 9 finished with values: [1.2941529227509478, 0.7043142560996046] and parameters: {'top_n': 9, 'n_estimators': 600, 'max_depth': 6, 'min_samples_leaf': 16, 'split_leaf_multiplier': 2, 'max_features': 'sqrt'}.[0m
[reduced trial 010] N=10 RMST=0.1454 C=0.7059 params={'n_estimators': 600, 'max_depth': 6, 'min_samples_leaf': 16, 'min_samples_split': 32, 'max_features': 'sqrt'}
[32m[I 2026-08-23 01:16:38,512][0m Trial 10 finished with values: [0.14543523294736657, 0.7059062668743832] and parameters: {'top_n': 10, 'n_estimators': 600, 'max_depth': 6, 'min_samples_leaf': 16, 'split_leaf_multiplier': 2, 'max_features': 'sqrt'}.[0m
[reduced trial 011] N=11 RMST=0.7400 C=0.7076 params={'n_estimators': 600, 'max_depth': 6, 'min_samples_leaf': 16, 'min_samples_split': 32, 'max_features': 'sqrt'}
[32m[I 2026-08-23 01:16:40,373][0m Trial 11 finished with values: [0.7400257246050176, 0.7076193077080631] and parameters: {'top_n': 11, 'n_estimators': 600, 'max_depth': 6, 'min_samples_leaf': 16, 'split_leaf_multiplier': 2, 'max_features': 'sqrt'}.[0m
[reduced trial 012] N=12 RMST=0.2802 C=0.7029 params={'n_estimators': 600, 'max_depth': 6, 'min_samples_leaf': 16, 'min_samples_split': 32, 'max_features': 'sqrt'}
[32m[I 2026-08-23 01:16:42,310][0m Trial 12 finished with values: [0.28015641873117547, 0.7028898254063817] and parameters: {'top_n': 12, 'n_estimators': 600, 'max_depth': 6, 'min_samples_leaf': 16, 'split_leaf_multiplier': 2, 'max_features': 'sqrt'}.[0m
[reduced trial 013] N=13 RMST=-2.1037 C=0.7033 params={'n_estimators': 600, 'max_depth': 6, 'min_samples_leaf': 16, 'min_samples_split': 32, 'max_features': 'sqrt'}
[32m[I 2026-08-23 01:16:44,278][0m Trial 13 finished with values: [-2.103725073245354, 0.7032932589360527] and parameters: {'top_n': 13, 'n_estimators': 600, 'max_depth': 6, 'min_samples_leaf': 16, 'split_leaf_multiplier': 2, 'max_features': 'sqrt'}.[0m
[reduced trial 014] N=14 RMST=-0.2587 C=0.7043 params={'n_estimators': 600, 'max_depth': 6, 'min_samples_leaf': 16, 'min_samples_split': 32, 'max_features': 'sqrt'}
[32m[I 2026-08-23 01:16:46,250][0m Trial 14 finished with values: [-0.25867656543930484, 0.7042987394253866] and parameters: {'top_n': 14, 'n_estimators': 600, 'max_depth': 6, 'min_samples_leaf': 16, 'split_leaf_multiplier': 2, 'max_features': 'sqrt'}.[0m
[reduced trial 015] N=15 RMST=1.4326 C=0.7039 params={'n_estimators': 600, 'max_depth': 6, 'min_samples_leaf': 16, 'min_samples_split': 32, 'max_features': 'sqrt'}
[32m[I 2026-08-23 01:16:48,273][0m Trial 15 finished with values: [1.4326339686359109, 0.7039356492486827] and parameters: {'top_n': 15, 'n_estimators': 600, 'max_depth': 6, 'min_samples_leaf': 16, 'split_leaf_multiplier': 2, 'max_features': 'sqrt'}.[0m
[reduced trial 016] N=16 RMST=3.7587 C=0.7073 params={'n_estimators': 600, 'max_depth': 6, 'min_samples_leaf': 16, 'min_samples_split': 32, 'max_features': 'sqrt'}
[32m[I 2026-08-23 01:16:50,312][0m Trial 16 finished with values: [3.7586622411746364, 0.7072562175313591] and parameters: {'top_n': 16, 'n_estimators': 600, 'max_depth': 6, 'min_samples_leaf': 16, 'split_leaf_multiplier': 2, 'max_features': 'sqrt'}.[0m
[reduced trial 017] N=17 RMST=1.4015 C=0.7079 params={'n_estimators': 600, 'max_depth': 6, 'min_samples_leaf': 16, 'min_samples_split': 32, 'max_features': 'sqrt'}
[32m[I 2026-08-23 01:16:52,590][0m Trial 17 finished with values: [1.4014671466167747, 0.7079389511969563] and parameters: {'top_n': 17, 'n_estimators': 600, 'max_depth': 6, 'min_samples_leaf': 16, 'split_leaf_multiplier': 2, 'max_features': 'sqrt'}.[0m
[reduced trial 018] N=18 RMST=3.8280 C=0.7063 params={'n_estimators': 600, 'max_depth': 6, 'min_samples_leaf': 16, 'min_samples_split': 32, 'max_features': 'sqrt'}
[32m[I 2026-08-23 01:16:54,910][0m Trial 18 finished with values: [3.8280261140061413, 0.7063376304176469] and parameters: {'top_n': 18, 'n_estimators': 600, 'max_depth': 6, 'min_samples_leaf': 16, 'split_leaf_multiplier': 2, 'max_features': 'sqrt'}.[0m
[reduced trial 019] N=19 RMST=-1.0084 C=0.7076 params={'n_estimators': 600, 'max_depth': 6, 'min_samples_leaf': 16, 'min_samples_split': 32, 'max_features': 'sqrt'}
[32m[I 2026-08-23 01:16:57,266][0m Trial 19 finished with values: [-1.0083566752687658, 0.7076255143777503] and parameters: {'top_n': 19, 'n_estimators': 600, 'max_depth': 6, 'min_samples_leaf': 16, 'split_leaf_multiplier': 2, 'max_features': 'sqrt'}.[0m
[reduced trial 020] N=20 RMST=3.0088 C=0.7090 params={'n_estimators': 600, 'max_depth': 6, 'min_samples_leaf': 16, 'min_samples_split': 32, 'max_features': 'sqrt'}
[32m[I 2026-08-23 01:16:59,615][0m Trial 20 finished with values: [3.0088095497428515, 0.7089847750392572] and parameters: {'top_n': 20, 'n_estimators': 600, 'max_depth': 6, 'min_samples_leaf': 16, 'split_leaf_multiplier': 2, 'max_features': 'sqrt'}.[0m
[reduced trial 021] N=21 RMST=1.4088 C=0.7093 params={'n_estimators': 600, 'max_depth': 6, 'min_samples_leaf': 16, 'min_samples_split': 32, 'max_features': 'sqrt'}
[32m[I 2026-08-23 01:17:02,069][0m Trial 21 finished with values: [1.408767811317234, 0.7093168318675248] and parameters: {'top_n': 21, 'n_estimators': 600, 'max_depth': 6, 'min_samples_leaf': 16, 'split_leaf_multiplier': 2, 'max_features': 'sqrt'}.[0m
[reduced trial 022] N=22 RMST=0.5425 C=0.7060 params={'n_estimators': 600, 'max_depth': 6, 'min_samples_leaf': 16, 'min_samples_split': 32, 'max_features': 'sqrt'}
[32m[I 2026-08-23 01:17:04,511][0m Trial 22 finished with values: [0.5424952398513561, 0.7060272969332845] and parameters: {'top_n': 22, 'n_estimators': 600, 'max_depth': 6, 'min_samples_leaf': 16, 'split_leaf_multiplier': 2, 'max_features': 'sqrt'}.[0m
[reduced trial 023] N=23 RMST=1.1555 C=0.7063 params={'n_estimators': 600, 'max_depth': 6, 'min_samples_leaf': 16, 'min_samples_split': 32, 'max_features': 'sqrt'}
[32m[I 2026-08-23 01:17:06,988][0m Trial 23 finished with values: [1.1554573363181266, 0.7063128037388978] and parameters: {'top_n': 23, 'n_estimators': 600, 'max_depth': 6, 'min_samples_leaf': 16, 'split_leaf_multiplier': 2, 'max_features': 'sqrt'}.[0m
[reduced trial 024] N=24 RMST=-0.7995 C=0.7059 params={'n_estimators': 600, 'max_depth': 6, 'min_samples_leaf': 16, 'min_samples_split': 32, 'max_features': 'sqrt'}
[32m[I 2026-08-23 01:17:09,488][0m Trial 24 finished with values: [-0.7994951029617474, 0.7058721301911034] and parameters: {'top_n': 24, 'n_estimators': 600, 'max_depth': 6, 'min_samples_leaf': 16, 'split_leaf_multiplier': 2, 'max_features': 'sqrt'}.[0m
[reduced trial 025] N=25 RMST=0.9550 C=0.7105 params={'n_estimators': 600, 'max_depth': 6, 'min_samples_leaf': 16, 'min_samples_split': 32, 'max_features': 'sqrt'}
[32m[I 2026-08-23 01:17:12,024][0m Trial 25 finished with values: [0.9549601934177863, 0.7104557557551344] and parameters: {'top_n': 25, 'n_estimators': 600, 'max_depth': 6, 'min_samples_leaf': 16, 'split_leaf_multiplier': 2, 'max_features': 'sqrt'}.[0m
[reduced trial 026] N=26 RMST=-0.0548 C=0.7094 params={'n_estimators': 600, 'max_depth': 6, 'min_samples_leaf': 16, 'min_samples_split': 32, 'max_features': 'sqrt'}
[32m[I 2026-08-23 01:17:14,606][0m Trial 26 finished with values: [-0.05484696748343711, 0.7093944152386155] and parameters: {'top_n': 26, 'n_estimators': 600, 'max_depth': 6, 'min_samples_leaf': 16, 'split_leaf_multiplier': 2, 'max_features': 'sqrt'}.[0m
[reduced trial 027] N=27 RMST=2.5484 C=0.7081 params={'n_estimators': 600, 'max_depth': 6, 'min_samples_leaf': 16, 'min_samples_split': 32, 'max_features': 'sqrt'}
[32m[I 2026-08-23 01:17:17,238][0m Trial 27 finished with values: [2.548359048907929, 0.7081003246088247] and parameters: {'top_n': 27, 'n_estimators': 600, 'max_depth': 6, 'min_samples_leaf': 16, 'split_leaf_multiplier': 2, 'max_features': 'sqrt'}.[0m
[reduced trial 028] N=28 RMST=2.6436 C=0.7091 params={'n_estimators': 600, 'max_depth': 6, 'min_samples_leaf': 16, 'min_samples_split': 32, 'max_features': 'sqrt'}
[32m[I 2026-08-23 01:17:19,857][0m Trial 28 finished with values: [2.6436439728015015, 0.709143045116282] and parameters: {'top_n': 28, 'n_estimators': 600, 'max_depth': 6, 'min_samples_leaf': 16, 'split_leaf_multiplier': 2, 'max_features': 'sqrt'}.[0m
[reduced trial 029] N=29 RMST=2.1502 C=0.7110 params={'n_estimators': 600, 'max_depth': 6, 'min_samples_leaf': 16, 'min_samples_split': 32, 'max_features': 'sqrt'}
[32m[I 2026-08-23 01:17:22,513][0m Trial 29 finished with values: [2.1501603092985055, 0.7110298727012048] and parameters: {'top_n': 29, 'n_estimators': 600, 'max_depth': 6, 'min_samples_leaf': 16, 'split_leaf_multiplier': 2, 'max_features': 'sqrt'}.[0m
[reduced trial 030] N=30 RMST=2.4420 C=0.7105 params={'n_estimators': 600, 'max_depth': 6, 'min_samples_leaf': 16, 'min_samples_split': 32, 'max_features': 'sqrt'}
[32m[I 2026-08-23 01:17:25,492][0m Trial 30 finished with values: [2.4420045406529938, 0.7104712724293526] and parameters: {'top_n': 30, 'n_estimators': 600, 'max_depth': 6, 'min_samples_leaf': 16, 'split_leaf_multiplier': 2, 'max_features': 'sqrt'}.[0m
[reduced trial 031] N=31 RMST=-2.8751 C=0.7082 params={'n_estimators': 600, 'max_depth': 6, 'min_samples_leaf': 16, 'min_samples_split': 32, 'max_features': 'sqrt'}
[32m[I 2026-08-23 01:17:28,487][0m Trial 31 finished with values: [-2.8751298078133196, 0.7082306646722568] and parameters: {'top_n': 31, 'n_estimators': 600, 'max_depth': 6, 'min_samples_leaf': 16, 'split_leaf_multiplier': 2, 'max_features': 'sqrt'}.[0m
[reduced trial 032] N=32 RMST=0.6596 C=0.7087 params={'n_estimators': 600, 'max_depth': 6, 'min_samples_leaf': 16, 'min_samples_split': 32, 'max_features': 'sqrt'}
[32m[I 2026-08-23 01:17:31,483][0m Trial 32 finished with values: [0.6596062207796304, 0.7086868548942694] and parameters: {'top_n': 32, 'n_estimators': 600, 'max_depth': 6, 'min_samples_leaf': 16, 'split_leaf_multiplier': 2, 'max_features': 'sqrt'}.[0m
[reduced trial 033] N=03 RMST=0.1973 C=0.7039 params={'n_estimators': 600, 'max_depth': 4, 'min_samples_leaf': 32, 'min_samples_split': 96, 'max_features': 0.25}
[32m[I 2026-08-23 01:17:33,176][0m Trial 33 finished with values: [0.19733144332438507, 0.7039387525835262] and parameters: {'top_n': 3, 'n_estimators': 600, 'max_depth': 4, 'min_samples_leaf': 32, 'split_leaf_multiplier': 3, 'max_features': 0.25}.[0m
[reduced trial 034] N=07 RMST=-0.8816 C=0.7094 params={'n_estimators': 600, 'max_depth': 8, 'min_samples_leaf': 8, 'min_samples_split': 16, 'max_features': 'sqrt'}
[32m[I 2026-08-23 01:17:35,214][0m Trial 34 finished with values: [-0.8816197025170329, 0.7094037252431463] and parameters: {'top_n': 7, 'n_estimators': 600, 'max_depth': 8, 'min_samples_leaf': 8, 'split_leaf_multiplier': 2, 'max_features': 'sqrt'}.[0m
[reduced trial 035] N=00 RMST=0.9603 C=0.6825 params={'n_estimators': 200, 'max_depth': 6, 'min_samples_leaf': 16, 'min_samples_split': 32, 'max_features': 'sqrt'}
[32m[I 2026-08-23 01:17:35,997][0m Trial 35 finished with values: [0.960317960326854, 0.6824574687959681] and parameters: {'top_n': 0, 'n_estimators': 200, 'max_depth': 6, 'min_samples_leaf': 16, 'split_leaf_multiplier': 2, 'max_features': 'sqrt'}.[0m
[reduced trial 036] N=09 RMST=1.2101 C=0.7019 params={'n_estimators': 600, 'max_depth': 6, 'min_samples_leaf': 32, 'min_samples_split': 96, 'max_features': 'sqrt'}
[32m[I 2026-08-23 01:17:38,098][0m Trial 36 finished with values: [1.210127681031156, 0.7018812415822042] and parameters: {'top_n': 9, 'n_estimators': 600, 'max_depth': 6, 'min_samples_leaf': 32, 'split_leaf_multiplier': 3, 'max_features': 'sqrt'}.[0m
[reduced trial 037] N=06 RMST=2.5750 C=0.7045 params={'n_estimators': 400, 'max_depth': 6, 'min_samples_leaf': 16, 'min_samples_split': 32, 'max_features': 'sqrt'}
[32m[I 2026-08-23 01:17:39,423][0m Trial 37 finished with values: [2.574956064511371, 0.7044880428508475] and parameters: {'top_n': 6, 'n_estimators': 400, 'max_depth': 6, 'min_samples_leaf': 16, 'split_leaf_multiplier': 2, 'max_features': 'sqrt'}.[0m
[reduced trial 038] N=03 RMST=-0.8872 C=0.7042 params={'n_estimators': 600, 'max_depth': 8, 'min_samples_leaf': 16, 'min_samples_split': 32, 'max_features': 0.25}
[32m[I 2026-08-23 01:17:41,045][0m Trial 38 finished with values: [-0.8871796019524584, 0.7042273627239832] and parameters: {'top_n': 3, 'n_estimators': 600, 'max_depth': 8, 'min_samples_leaf': 16, 'split_leaf_multiplier': 2, 'max_features': 0.25}.[0m
[reduced trial 039] N=28 RMST=0.2219 C=0.6990 params={'n_estimators': 400, 'max_depth': 8, 'min_samples_leaf': 32, 'min_samples_split': 96, 'max_features': 0.25}
