[I 2026-08-22 17:21:00,763] A new study created in memory with name: no-name-6be81781-6cd3-4fa9-b3e1-190250330698
[screening trial 000] RMST=0.2183 C=0.6708 params={'n_estimators': 250, 'max_depth': 4, 'min_samples_leaf': 16, 'min_samples_split': 32, 'max_features': 0.25}
[I 2026-08-22 17:25:54,007] Trial 0 finished with values: [0.21834611561134748, 0.6707625514377751] and parameters: {'n_estimators': 250, 'max_depth': 4, 'min_samples_leaf': 16, 'split_leaf_multiplier': 2, 'max_features': 0.25}.
[screening trial 001] RMST=0.2183 C=0.6653 params={'n_estimators': 250, 'max_depth': 6, 'min_samples_leaf': 16, 'min_samples_split': 32, 'max_features': 0.5}
[I 2026-08-22 17:38:21,886] Trial 1 finished with values: [0.21834611561134748, 0.6653068887826858] and parameters: {'n_estimators': 250, 'max_depth': 6, 'min_samples_leaf': 16, 'split_leaf_multiplier': 2, 'max_features': 0.5}.
[screening trial 002] RMST=0.2183 C=0.6619 params={'n_estimators': 150, 'max_depth': 6, 'min_samples_leaf': 16, 'min_samples_split': 32, 'max_features': 0.5}
[I 2026-08-22 17:45:51,452] Trial 2 finished with values: [0.21834611561134748, 0.6619025304592315] and parameters: {'n_estimators': 150, 'max_depth': 6, 'min_samples_leaf': 16, 'split_leaf_multiplier': 2, 'max_features': 0.5}.
[screening trial 003] RMST=0.2183 C=0.6607 params={'n_estimators': 150, 'max_depth': 4, 'min_samples_leaf': 16, 'min_samples_split': 32, 'max_features': 0.5}
[I 2026-08-22 17:51:32,745] Trial 3 finished with values: [0.21834611561134748, 0.6607015398747494] and parameters: {'n_estimators': 150, 'max_depth': 4, 'min_samples_leaf': 16, 'split_leaf_multiplier': 2, 'max_features': 0.5}.
[screening trial 004] RMST=0.2183 C=0.6673 params={'n_estimators': 250, 'max_depth': 6, 'min_samples_leaf': 16, 'min_samples_split': 32, 'max_features': 0.25}
[I 2026-08-22 17:57:35,776] Trial 4 finished with values: [0.21834611561134748, 0.6672945747500264] and parameters: {'n_estimators': 250, 'max_depth': 6, 'min_samples_leaf': 16, 'split_leaf_multiplier': 2, 'max_features': 0.25}.
[screening trial 005] RMST=0.2183 C=0.6641 params={'n_estimators': 150, 'max_depth': 6, 'min_samples_leaf': 16, 'min_samples_split': 32, 'max_features': 0.25}
[I 2026-08-22 18:01:14,302] Trial 5 finished with values: [0.21834611561134748, 0.6640702098475021] and parameters: {'n_estimators': 150, 'max_depth': 6, 'min_samples_leaf': 16, 'split_leaf_multiplier': 2, 'max_features': 0.25}.
[screening trial 006] RMST=0.2183 C=0.6607 params={'n_estimators': 150, 'max_depth': 4, 'min_samples_leaf': 16, 'min_samples_split': 32, 'max_features': 0.5}
[I 2026-08-22 18:06:54,864] Trial 6 finished with values: [0.21834611561134748, 0.6607015398747494] and parameters: {'n_estimators': 150, 'max_depth': 4, 'min_samples_leaf': 16, 'split_leaf_multiplier': 2, 'max_features': 0.5}.
[screening trial 007] RMST=0.2183 C=0.6653 params={'n_estimators': 250, 'max_depth': 6, 'min_samples_leaf': 16, 'min_samples_split': 32, 'max_features': 0.5}
[I 2026-08-22 18:19:17,820] Trial 7 finished with values: [0.21834611561134748, 0.6653068887826858] and parameters: {'n_estimators': 250, 'max_depth': 6, 'min_samples_leaf': 16, 'split_leaf_multiplier': 2, 'max_features': 0.5}.
[screening trial 008] RMST=0.2183 C=0.6680 params={'n_estimators': 150, 'max_depth': 4, 'min_samples_leaf': 16, 'min_samples_split': 32, 'max_features': 0.25}
[I 2026-08-22 18:22:06,065] Trial 8 finished with values: [0.21834611561134748, 0.668022306770856] and parameters: {'n_estimators': 150, 'max_depth': 4, 'min_samples_leaf': 16, 'split_leaf_multiplier': 2, 'max_features': 0.25}.
[screening trial 009] RMST=0.2183 C=0.6653 params={'n_estimators': 250, 'max_depth': 6, 'min_samples_leaf': 16, 'min_samples_split': 32, 'max_features': 0.5}
[I 2026-08-22 18:34:34,319] Trial 9 finished with values: [0.21834611561134748, 0.6653068887826858] and parameters: {'n_estimators': 250, 'max_depth': 6, 'min_samples_leaf': 16, 'split_leaf_multiplier': 2, 'max_features': 0.5}.
[screening trial 010] RMST=0.2183 C=0.6607 params={'n_estimators': 150, 'max_depth': 4, 'min_samples_leaf': 16, 'min_samples_split': 32, 'max_features': 0.5}
[I 2026-08-22 18:40:18,347] Trial 10 finished with values: [0.21834611561134748, 0.6607015398747494] and parameters: {'n_estimators': 150, 'max_depth': 4, 'min_samples_leaf': 16, 'split_leaf_multiplier': 2, 'max_features': 0.5}.
[screening trial 011] RMST=0.2183 C=0.6673 params={'n_estimators': 250, 'max_depth': 6, 'min_samples_leaf': 16, 'min_samples_split': 32, 'max_features': 0.25}
[I 2026-08-22 18:46:24,297] Trial 11 finished with values: [0.21834611561134748, 0.6672945747500264] and parameters: {'n_estimators': 250, 'max_depth': 6, 'min_samples_leaf': 16, 'split_leaf_multiplier': 2, 'max_features': 0.25}.
[PFI fold 1] 1114/8666 features used by a split
[PFI fold 2] 1289/8666 features used by a split
[PFI fold 2] processed through feature 1000
[PFI fold 2] processed through feature 3250
[PFI fold 2] processed through feature 3750
[PFI fold 2] processed through feature 7750
[PFI fold 3] 1069/8666 features used by a split
[PFI fold 3] processed through feature 1250
[PFI fold 3] processed through feature 3500
[PFI fold 3] processed through feature 5500
[I 2026-08-22 19:27:08,714] A new study created in memory with name: no-name-5c8c61ea-2687-41b6-aa31-926f4f61423a
[reduced trial 000] N=00 RMST=3.3950 C=0.6825 params={'n_estimators': 400, 'max_depth': 6, 'min_samples_leaf': 16, 'min_samples_split': 32, 'max_features': 'sqrt'}
[I 2026-08-22 19:27:10,518] Trial 0 finished with values: [3.394965377171216, 0.6825071221534661] and parameters: {'top_n': 0, 'n_estimators': 400, 'max_depth': 6, 'min_samples_leaf': 16, 'split_leaf_multiplier': 2, 'max_features': 'sqrt'}.
[reduced trial 001] N=01 RMST=2.9319 C=0.6965 params={'n_estimators': 400, 'max_depth': 6, 'min_samples_leaf': 16, 'min_samples_split': 32, 'max_features': 'sqrt'}
[I 2026-08-22 19:27:12,398] Trial 1 finished with values: [2.9318922650807604, 0.696541953983751] and parameters: {'top_n': 1, 'n_estimators': 400, 'max_depth': 6, 'min_samples_leaf': 16, 'split_leaf_multiplier': 2, 'max_features': 'sqrt'}.
[reduced trial 002] N=02 RMST=2.1235 C=0.6953 params={'n_estimators': 400, 'max_depth': 6, 'min_samples_leaf': 16, 'min_samples_split': 32, 'max_features': 'sqrt'}
[I 2026-08-22 19:27:14,362] Trial 2 finished with values: [2.1234836613637773, 0.6953238950576289] and parameters: {'top_n': 2, 'n_estimators': 400, 'max_depth': 6, 'min_samples_leaf': 16, 'split_leaf_multiplier': 2, 'max_features': 'sqrt'}.
[reduced trial 003] N=03 RMST=3.6810 C=0.6992 params={'n_estimators': 400, 'max_depth': 6, 'min_samples_leaf': 16, 'min_samples_split': 32, 'max_features': 'sqrt'}
[I 2026-08-22 19:27:16,311] Trial 3 finished with values: [3.681005463881185, 0.699175133598565] and parameters: {'top_n': 3, 'n_estimators': 400, 'max_depth': 6, 'min_samples_leaf': 16, 'split_leaf_multiplier': 2, 'max_features': 'sqrt'}.
[reduced trial 004] N=04 RMST=1.9724 C=0.7055 params={'n_estimators': 400, 'max_depth': 6, 'min_samples_leaf': 16, 'min_samples_split': 32, 'max_features': 'sqrt'}
[I 2026-08-22 19:27:18,254] Trial 4 finished with values: [1.9724491180483352, 0.7054624899917451] and parameters: {'top_n': 4, 'n_estimators': 400, 'max_depth': 6, 'min_samples_leaf': 16, 'split_leaf_multiplier': 2, 'max_features': 'sqrt'}.
[reduced trial 005] N=05 RMST=1.5000 C=0.7038 params={'n_estimators': 400, 'max_depth': 6, 'min_samples_leaf': 16, 'min_samples_split': 32, 'max_features': 'sqrt'}
[I 2026-08-22 19:27:20,232] Trial 5 finished with values: [1.4999568245906305, 0.7038394458685303] and parameters: {'top_n': 5, 'n_estimators': 400, 'max_depth': 6, 'min_samples_leaf': 16, 'split_leaf_multiplier': 2, 'max_features': 'sqrt'}.
[reduced trial 006] N=06 RMST=3.7766 C=0.7044 params={'n_estimators': 400, 'max_depth': 6, 'min_samples_leaf': 16, 'min_samples_split': 32, 'max_features': 'sqrt'}
[I 2026-08-22 19:27:22,257] Trial 6 finished with values: [3.7765915556205805, 0.7043825294661643] and parameters: {'top_n': 6, 'n_estimators': 400, 'max_depth': 6, 'min_samples_leaf': 16, 'split_leaf_multiplier': 2, 'max_features': 'sqrt'}.
[reduced trial 007] N=07 RMST=1.7223 C=0.7112 params={'n_estimators': 400, 'max_depth': 6, 'min_samples_leaf': 16, 'min_samples_split': 32, 'max_features': 'sqrt'}
[I 2026-08-22 19:27:24,324] Trial 7 finished with values: [1.7222502133120048, 0.7112067627872912] and parameters: {'top_n': 7, 'n_estimators': 400, 'max_depth': 6, 'min_samples_leaf': 16, 'split_leaf_multiplier': 2, 'max_features': 'sqrt'}.
[reduced trial 008] N=08 RMST=2.6249 C=0.7132 params={'n_estimators': 400, 'max_depth': 6, 'min_samples_leaf': 16, 'min_samples_split': 32, 'max_features': 'sqrt'}
[I 2026-08-22 19:27:26,363] Trial 8 finished with values: [2.624878807960568, 0.7132425504447079] and parameters: {'top_n': 8, 'n_estimators': 400, 'max_depth': 6, 'min_samples_leaf': 16, 'split_leaf_multiplier': 2, 'max_features': 'sqrt'}.
[reduced trial 009] N=09 RMST=1.3293 C=0.7154 params={'n_estimators': 400, 'max_depth': 6, 'min_samples_leaf': 16, 'min_samples_split': 32, 'max_features': 'sqrt'}
[I 2026-08-22 19:27:28,472] Trial 9 finished with values: [1.3292509296479451, 0.7153714381474332] and parameters: {'top_n': 9, 'n_estimators': 400, 'max_depth': 6, 'min_samples_leaf': 16, 'split_leaf_multiplier': 2, 'max_features': 'sqrt'}.
[reduced trial 010] N=10 RMST=3.2565 C=0.7181 params={'n_estimators': 400, 'max_depth': 6, 'min_samples_leaf': 16, 'min_samples_split': 32, 'max_features': 'sqrt'}
[I 2026-08-22 19:27:30,570] Trial 10 finished with values: [3.2565221173936028, 0.7180527194523235] and parameters: {'top_n': 10, 'n_estimators': 400, 'max_depth': 6, 'min_samples_leaf': 16, 'split_leaf_multiplier': 2, 'max_features': 'sqrt'}.
[reduced trial 011] N=11 RMST=2.8937 C=0.7187 params={'n_estimators': 400, 'max_depth': 6, 'min_samples_leaf': 16, 'min_samples_split': 32, 'max_features': 'sqrt'}
[I 2026-08-22 19:27:32,729] Trial 11 finished with values: [2.893694471014688, 0.7186702830862044] and parameters: {'top_n': 11, 'n_estimators': 400, 'max_depth': 6, 'min_samples_leaf': 16, 'split_leaf_multiplier': 2, 'max_features': 'sqrt'}.
[reduced trial 012] N=12 RMST=4.5508 C=0.7183 params={'n_estimators': 400, 'max_depth': 6, 'min_samples_leaf': 16, 'min_samples_split': 32, 'max_features': 'sqrt'}
[I 2026-08-22 19:27:34,925] Trial 12 finished with values: [4.550797003866151, 0.7182668495565334] and parameters: {'top_n': 12, 'n_estimators': 400, 'max_depth': 6, 'min_samples_leaf': 16, 'split_leaf_multiplier': 2, 'max_features': 'sqrt'}.
[reduced trial 013] N=13 RMST=1.4823 C=0.7182 params={'n_estimators': 400, 'max_depth': 6, 'min_samples_leaf': 16, 'min_samples_split': 32, 'max_features': 'sqrt'}
[I 2026-08-22 19:27:37,096] Trial 13 finished with values: [1.482319530879245, 0.7181892661854429] and parameters: {'top_n': 13, 'n_estimators': 400, 'max_depth': 6, 'min_samples_leaf': 16, 'split_leaf_multiplier': 2, 'max_features': 'sqrt'}.
[reduced trial 014] N=14 RMST=2.4331 C=0.7196 params={'n_estimators': 400, 'max_depth': 6, 'min_samples_leaf': 16, 'min_samples_split': 32, 'max_features': 'sqrt'}
[I 2026-08-22 19:27:39,297] Trial 14 finished with values: [2.4331311329127603, 0.7196074902089785] and parameters: {'top_n': 14, 'n_estimators': 400, 'max_depth': 6, 'min_samples_leaf': 16, 'split_leaf_multiplier': 2, 'max_features': 'sqrt'}.
[reduced trial 015] N=15 RMST=1.2945 C=0.7169 params={'n_estimators': 400, 'max_depth': 6, 'min_samples_leaf': 16, 'min_samples_split': 32, 'max_features': 'sqrt'}
[I 2026-08-22 19:27:41,500] Trial 15 finished with values: [1.2945432796247585, 0.7168610388723723] and parameters: {'top_n': 15, 'n_estimators': 400, 'max_depth': 6, 'min_samples_leaf': 16, 'split_leaf_multiplier': 2, 'max_features': 'sqrt'}.
[reduced trial 016] N=16 RMST=2.1212 C=0.7168 params={'n_estimators': 400, 'max_depth': 6, 'min_samples_leaf': 16, 'min_samples_split': 32, 'max_features': 'sqrt'}
[I 2026-08-22 19:27:43,757] Trial 16 finished with values: [2.1211578198561174, 0.7167989721754998] and parameters: {'top_n': 16, 'n_estimators': 400, 'max_depth': 6, 'min_samples_leaf': 16, 'split_leaf_multiplier': 2, 'max_features': 'sqrt'}.
[reduced trial 017] N=17 RMST=2.9881 C=0.7187 params={'n_estimators': 400, 'max_depth': 6, 'min_samples_leaf': 16, 'min_samples_split': 32, 'max_features': 'sqrt'}
[I 2026-08-22 19:27:46,075] Trial 17 finished with values: [2.9881329991611647, 0.7186702830862044] and parameters: {'top_n': 17, 'n_estimators': 400, 'max_depth': 6, 'min_samples_leaf': 16, 'split_leaf_multiplier': 2, 'max_features': 'sqrt'}.
[reduced trial 018] N=18 RMST=0.9361 C=0.7213 params={'n_estimators': 400, 'max_depth': 6, 'min_samples_leaf': 16, 'min_samples_split': 32, 'max_features': 'sqrt'}
[I 2026-08-22 19:27:48,442] Trial 18 finished with values: [0.936090638078239, 0.721258464345786] and parameters: {'top_n': 18, 'n_estimators': 400, 'max_depth': 6, 'min_samples_leaf': 16, 'split_leaf_multiplier': 2, 'max_features': 'sqrt'}.
[reduced trial 019] N=19 RMST=-0.5647 C=0.7176 params={'n_estimators': 400, 'max_depth': 6, 'min_samples_leaf': 16, 'min_samples_split': 32, 'max_features': 'sqrt'}
[I 2026-08-22 19:27:50,792] Trial 19 finished with values: [-0.5646852018316175, 0.717636872583278] and parameters: {'top_n': 19, 'n_estimators': 400, 'max_depth': 6, 'min_samples_leaf': 16, 'split_leaf_multiplier': 2, 'max_features': 'sqrt'}.
[reduced trial 020] N=20 RMST=-0.0580 C=0.7188 params={'n_estimators': 400, 'max_depth': 6, 'min_samples_leaf': 16, 'min_samples_split': 32, 'max_features': 'sqrt'}
[I 2026-08-22 19:27:53,165] Trial 20 finished with values: [-0.058012549672289394, 0.7188068298193239] and parameters: {'top_n': 20, 'n_estimators': 400, 'max_depth': 6, 'min_samples_leaf': 16, 'split_leaf_multiplier': 2, 'max_features': 'sqrt'}.
[reduced trial 021] N=21 RMST=3.4563 C=0.7184 params={'n_estimators': 400, 'max_depth': 6, 'min_samples_leaf': 16, 'min_samples_split': 32, 'max_features': 'sqrt'}
[I 2026-08-22 19:27:55,675] Trial 21 finished with values: [3.4562973633789547, 0.7183816729457475] and parameters: {'top_n': 21, 'n_estimators': 400, 'max_depth': 6, 'min_samples_leaf': 16, 'split_leaf_multiplier': 2, 'max_features': 'sqrt'}.
[reduced trial 022] N=22 RMST=-0.7136 C=0.7183 params={'n_estimators': 400, 'max_depth': 6, 'min_samples_leaf': 16, 'min_samples_split': 32, 'max_features': 'sqrt'}
[I 2026-08-22 19:27:58,133] Trial 22 finished with values: [-0.7135685415921132, 0.7183102962443442] and parameters: {'top_n': 22, 'n_estimators': 400, 'max_depth': 6, 'min_samples_leaf': 16, 'split_leaf_multiplier': 2, 'max_features': 'sqrt'}.
[reduced trial 023] N=23 RMST=3.9162 C=0.7184 params={'n_estimators': 400, 'max_depth': 6, 'min_samples_leaf': 16, 'min_samples_split': 32, 'max_features': 'sqrt'}
[I 2026-08-22 19:28:00,589] Trial 23 finished with values: [3.916220466192398, 0.7184344296380891] and parameters: {'top_n': 23, 'n_estimators': 400, 'max_depth': 6, 'min_samples_leaf': 16, 'split_leaf_multiplier': 2, 'max_features': 'sqrt'}.
[reduced trial 024] N=24 RMST=0.0946 C=0.7229 params={'n_estimators': 400, 'max_depth': 6, 'min_samples_leaf': 16, 'min_samples_split': 32, 'max_features': 'sqrt'}
[I 2026-08-22 19:28:03,013] Trial 24 finished with values: [0.09463934884403757, 0.722887715138688] and parameters: {'top_n': 24, 'n_estimators': 400, 'max_depth': 6, 'min_samples_leaf': 16, 'split_leaf_multiplier': 2, 'max_features': 'sqrt'}.
[reduced trial 025] N=25 RMST=1.2735 C=0.7189 params={'n_estimators': 400, 'max_depth': 6, 'min_samples_leaf': 16, 'min_samples_split': 32, 'max_features': 'sqrt'}
[I 2026-08-22 19:28:05,520] Trial 25 finished with values: [1.2734588196435195, 0.7189309632130688] and parameters: {'top_n': 25, 'n_estimators': 400, 'max_depth': 6, 'min_samples_leaf': 16, 'split_leaf_multiplier': 2, 'max_features': 'sqrt'}.
[reduced trial 026] N=26 RMST=0.9394 C=0.7217 params={'n_estimators': 400, 'max_depth': 6, 'min_samples_leaf': 16, 'min_samples_split': 32, 'max_features': 'sqrt'}
[I 2026-08-22 19:28:08,037] Trial 26 finished with values: [0.9394462242782107, 0.7216587945406133] and parameters: {'top_n': 26, 'n_estimators': 400, 'max_depth': 6, 'min_samples_leaf': 16, 'split_leaf_multiplier': 2, 'max_features': 'sqrt'}.
[reduced trial 027] N=27 RMST=-0.4323 C=0.7221 params={'n_estimators': 400, 'max_depth': 6, 'min_samples_leaf': 16, 'min_samples_split': 32, 'max_features': 'sqrt'}
[I 2026-08-22 19:28:10,555] Trial 27 finished with values: [-0.43231452603261933, 0.7221087780929387] and parameters: {'top_n': 27, 'n_estimators': 400, 'max_depth': 6, 'min_samples_leaf': 16, 'split_leaf_multiplier': 2, 'max_features': 'sqrt'}.
[reduced trial 028] N=28 RMST=4.8469 C=0.7208 params={'n_estimators': 400, 'max_depth': 6, 'min_samples_leaf': 16, 'min_samples_split': 32, 'max_features': 'sqrt'}
[I 2026-08-22 19:28:13,073] Trial 28 finished with values: [4.8469425141168525, 0.7207836541147117] and parameters: {'top_n': 28, 'n_estimators': 400, 'max_depth': 6, 'min_samples_leaf': 16, 'split_leaf_multiplier': 2, 'max_features': 'sqrt'}.
[reduced trial 029] N=29 RMST=1.5303 C=0.7222 params={'n_estimators': 400, 'max_depth': 6, 'min_samples_leaf': 16, 'min_samples_split': 32, 'max_features': 'sqrt'}
[I 2026-08-22 19:28:15,638] Trial 29 finished with values: [1.5302645324284074, 0.7222236014821527] and parameters: {'top_n': 29, 'n_estimators': 400, 'max_depth': 6, 'min_samples_leaf': 16, 'split_leaf_multiplier': 2, 'max_features': 'sqrt'}.
[reduced trial 030] N=30 RMST=2.1782 C=0.7218 params={'n_estimators': 400, 'max_depth': 6, 'min_samples_leaf': 16, 'min_samples_split': 32, 'max_features': 'sqrt'}
[I 2026-08-22 19:28:18,301] Trial 30 finished with values: [2.1782285601503517, 0.721776721264671] and parameters: {'top_n': 30, 'n_estimators': 400, 'max_depth': 6, 'min_samples_leaf': 16, 'split_leaf_multiplier': 2, 'max_features': 'sqrt'}.
[reduced trial 031] N=31 RMST=2.3110 C=0.7224 params={'n_estimators': 400, 'max_depth': 6, 'min_samples_leaf': 16, 'min_samples_split': 32, 'max_features': 'sqrt'}
[I 2026-08-22 19:28:21,038] Trial 31 finished with values: [2.311042610187368, 0.7224470415908936] and parameters: {'top_n': 31, 'n_estimators': 400, 'max_depth': 6, 'min_samples_leaf': 16, 'split_leaf_multiplier': 2, 'max_features': 'sqrt'}.
[reduced trial 032] N=32 RMST=0.8855 C=0.7216 params={'n_estimators': 400, 'max_depth': 6, 'min_samples_leaf': 16, 'min_samples_split': 32, 'max_features': 'sqrt'}
[I 2026-08-22 19:28:23,809] Trial 32 finished with values: [0.8854552994582184, 0.7216432778663953] and parameters: {'top_n': 32, 'n_estimators': 400, 'max_depth': 6, 'min_samples_leaf': 16, 'split_leaf_multiplier': 2, 'max_features': 'sqrt'}.
[reduced trial 033] N=03 RMST=1.2535 C=0.6953 params={'n_estimators': 400, 'max_depth': 4, 'min_samples_leaf': 32, 'min_samples_split': 96, 'max_features': 0.25}
[I 2026-08-22 19:28:25,849] Trial 33 finished with values: [1.2535293803403746, 0.6953269983924726] and parameters: {'top_n': 3, 'n_estimators': 400, 'max_depth': 4, 'min_samples_leaf': 32, 'split_leaf_multiplier': 3, 'max_features': 0.25}.
[reduced trial 034] N=07 RMST=1.6518 C=0.7157 params={'n_estimators': 400, 'max_depth': 8, 'min_samples_leaf': 8, 'min_samples_split': 16, 'max_features': 'sqrt'}
[I 2026-08-22 19:28:27,956] Trial 34 finished with values: [1.651781477746135, 0.7157283216544499] and parameters: {'top_n': 7, 'n_estimators': 400, 'max_depth': 8, 'min_samples_leaf': 8, 'split_leaf_multiplier': 2, 'max_features': 'sqrt'}.
[reduced trial 035] N=00 RMST=3.1650 C=0.6830 params={'n_estimators': 600, 'max_depth': 6, 'min_samples_leaf': 16, 'min_samples_split': 32, 'max_features': 'sqrt'}
[I 2026-08-22 19:28:30,273] Trial 35 finished with values: [3.1650041141702276, 0.6830036557284458] and parameters: {'top_n': 0, 'n_estimators': 600, 'max_depth': 6, 'min_samples_leaf': 16, 'split_leaf_multiplier': 2, 'max_features': 'sqrt'}.
[reduced trial 036] N=09 RMST=-0.0601 C=0.7089 params={'n_estimators': 400, 'max_depth': 6, 'min_samples_leaf': 32, 'min_samples_split': 96, 'max_features': 'sqrt'}
[I 2026-08-22 19:28:32,417] Trial 36 finished with values: [-0.06010604796922085, 0.7089475350211337] and parameters: {'top_n': 9, 'n_estimators': 400, 'max_depth': 6, 'min_samples_leaf': 32, 'split_leaf_multiplier': 3, 'max_features': 'sqrt'}.
[reduced trial 037] N=06 RMST=4.9427 C=0.7049 params={'n_estimators': 200, 'max_depth': 6, 'min_samples_leaf': 16, 'min_samples_split': 32, 'max_features': 'sqrt'}
[I 2026-08-22 19:28:33,964] Trial 37 finished with values: [4.942691961168536, 0.7048511330275514] and parameters: {'top_n': 6, 'n_estimators': 200, 'max_depth': 6, 'min_samples_leaf': 16, 'split_leaf_multiplier': 2, 'max_features': 'sqrt'}.
[reduced trial 038] N=03 RMST=2.1928 C=0.6989 params={'n_estimators': 400, 'max_depth': 8, 'min_samples_leaf': 16, 'min_samples_split': 32, 'max_features': 0.25}
[I 2026-08-22 19:28:35,906] Trial 38 finished with values: [2.192815162190802, 0.6988648001142027] and parameters: {'top_n': 3, 'n_estimators': 400, 'max_depth': 8, 'min_samples_leaf': 16, 'split_leaf_multiplier': 2, 'max_features': 0.25}.
[reduced trial 039] N=28 RMST=0.2183 C=0.7092 params={'n_estimators': 200, 'max_depth': 8, 'min_samples_leaf': 32, 'min_samples_split': 96, 'max_features': 0.25}
[I 2026-08-22 19:28:37,727] Trial 39 finished with values: [0.21834611561134748, 0.7092345934941688] and parameters: {'top_n': 28, 'n_estimators': 200, 'max_depth': 8, 'min_samples_leaf': 32, 'split_leaf_multiplier': 3, 'max_features': 0.25}.
[reduced trial 040] N=23 RMST=3.9162 C=0.7184 params={'n_estimators': 400, 'max_depth': 6, 'min_samples_leaf': 16, 'min_samples_split': 32, 'max_features': 'sqrt'}
