[I 2026-08-22 19:28:40,204] Trial 40 finished with values: [3.916220466192398, 0.7184344296380891] and parameters: {'top_n': 23, 'n_estimators': 400, 'max_depth': 6, 'min_samples_leaf': 16, 'split_leaf_multiplier': 2, 'max_features': 'sqrt'}.
[reduced trial 041] N=21 RMST=2.2930 C=0.7187 params={'n_estimators': 200, 'max_depth': 8, 'min_samples_leaf': 16, 'min_samples_split': 48, 'max_features': 'sqrt'}
[I 2026-08-22 19:28:41,934] Trial 41 finished with values: [2.2929613998525, 0.7186547664119863] and parameters: {'top_n': 21, 'n_estimators': 200, 'max_depth': 8, 'min_samples_leaf': 16, 'split_leaf_multiplier': 3, 'max_features': 'sqrt'}.
[reduced trial 042] N=24 RMST=1.4857 C=0.7198 params={'n_estimators': 600, 'max_depth': 6, 'min_samples_leaf': 16, 'min_samples_split': 48, 'max_features': 'sqrt'}
[I 2026-08-22 19:28:45,267] Trial 42 finished with values: [1.4856796684953468, 0.7197905869647523] and parameters: {'top_n': 24, 'n_estimators': 600, 'max_depth': 6, 'min_samples_leaf': 16, 'split_leaf_multiplier': 3, 'max_features': 'sqrt'}.
[reduced trial 043] N=27 RMST=-1.9451 C=0.7217 params={'n_estimators': 200, 'max_depth': 4, 'min_samples_leaf': 16, 'min_samples_split': 32, 'max_features': 'log2'}
[I 2026-08-22 19:28:46,875] Trial 43 finished with values: [-1.94512696574049, 0.7217301712420167] and parameters: {'top_n': 27, 'n_estimators': 200, 'max_depth': 4, 'min_samples_leaf': 16, 'split_leaf_multiplier': 2, 'max_features': 'log2'}.
[reduced trial 044] N=14 RMST=1.9857 C=0.7191 params={'n_estimators': 600, 'max_depth': 6, 'min_samples_leaf': 8, 'min_samples_split': 24, 'max_features': 'sqrt'}
[I 2026-08-22 19:28:49,784] Trial 44 finished with values: [1.9856603769766927, 0.7191357833127479] and parameters: {'top_n': 14, 'n_estimators': 600, 'max_depth': 6, 'min_samples_leaf': 8, 'split_leaf_multiplier': 3, 'max_features': 'sqrt'}.
[reduced trial 045] N=32 RMST=0.3162 C=0.7205 params={'n_estimators': 400, 'max_depth': 4, 'min_samples_leaf': 8, 'min_samples_split': 16, 'max_features': 'sqrt'}
[I 2026-08-22 19:28:52,515] Trial 45 finished with values: [0.3162427349582684, 0.7204950439742548] and parameters: {'top_n': 32, 'n_estimators': 400, 'max_depth': 4, 'min_samples_leaf': 8, 'split_leaf_multiplier': 2, 'max_features': 'sqrt'}.
[reduced trial 046] N=27 RMST=0.2183 C=0.7159 params={'n_estimators': 400, 'max_depth': 4, 'min_samples_leaf': 16, 'min_samples_split': 32, 'max_features': 0.25}
[I 2026-08-22 19:28:55,543] Trial 46 finished with values: [0.21834611561134748, 0.7158695233898347] and parameters: {'top_n': 27, 'n_estimators': 400, 'max_depth': 4, 'min_samples_leaf': 16, 'split_leaf_multiplier': 2, 'max_features': 0.25}.
[reduced trial 047] N=22 RMST=1.0447 C=0.7200 params={'n_estimators': 400, 'max_depth': 8, 'min_samples_leaf': 16, 'min_samples_split': 48, 'max_features': 'log2'}
[I 2026-08-22 19:28:58,002] Trial 47 finished with values: [1.0446641933351775, 0.7200202337431805] and parameters: {'top_n': 22, 'n_estimators': 400, 'max_depth': 8, 'min_samples_leaf': 16, 'split_leaf_multiplier': 3, 'max_features': 'log2'}.
[reduced trial 048] N=00 RMST=3.2370 C=0.6845 params={'n_estimators': 600, 'max_depth': 8, 'min_samples_leaf': 8, 'min_samples_split': 24, 'max_features': 0.25}
