[I 2026-08-22 21:36:56,185] Trial 48 finished with values: [1.8668926225426405, 0.6830610674230528] and parameters: {'top_n': 0, 'n_estimators': 600, 'max_depth': 4, 'min_samples_leaf': 16, 'split_leaf_multiplier': 3, 'max_features': 0.25}.
{
  "artifacts": {
    "final_covariates.txt": {
      "bytes": 431,
      "sha256": "67bdc6d17fdde585e4d12496bccff3dbf7e22b813bbdf0fb8f29a892408a757c"
    },
    "final_rsf.pkl": {
      "bytes": 359638999,
      "sha256": "a2bb05890478d3e299d0602a6b28565b4cc99c0828b5dd119432253509d0648a"
    },
    "final_spec.json": {
      "bytes": 2274,
      "sha256": "1670cf9a7b8a96965cc620a13f3b660d004a70982be06de3335c6edb36211c09"
    },
    "permutation_importance.csv": {
      "bytes": 499938,
      "sha256": "a537e77afcb4686c76d2c444361ee7d33e6162337062fafdaf94af3cde1296de"
    },
    "permutation_importance.png": {
      "bytes": 141097,
      "sha256": "fc86fa9327ca6690ec209b1148124bc53096e52ea1a0763533137d6fd2bf5689"
    },
    "top_n_results.csv": {
      "bytes": 3464,
      "sha256": "ef06583dd959b3583a01bd17f42d66cc676fccfaf5952792f14e1c9f8db7ffd9"
    },
    "training_imputation_medians.csv": {
      "bytes": 657,
      "sha256": "6eec538bebaf400acd712446ce54be9fcdfdbfb5acf2f216fa7a5eb973bb2196"
    }
  },
  "budget": {
    "cv_folds": 3,
    "fold_seed": 20260824,
    "forest_seed": 42,
    "max_experiments": 20,
    "max_top_genes": 32,
    "max_trees_per_forest": 1000,
    "permutation_repeats": 3,
    "permutation_seed": 20260825,
    "reduced_trials": 49,
    "schema_version": 1,
    "screening_trials": 12,
    "smoke_reductions_applied": false,
    "tau_months": 60.0,
    "wall_time_seconds": 14400
  },
  "candidate": {
    "name": "deep_fine_reference_v4",
    "plot_top_k": 32,
    "reduced_space": {
      "max_depth": [
        8,
        6,
        4
      ],
      "max_features": [
        "sqrt",
        "log2",
        0.25
      ],
      "min_samples_leaf": [
        8,
        16,
        32
      ],
      "n_estimators": [
        400,
        200,
        600
      ],
      "split_leaf_multiplier": [
        2,
        3
      ]
    },
    "screening_space": {
      "max_depth": [
        4,
        6
      ],
      "max_features": [
        0.25,
        0.5
      ],
      "min_samples_leaf": [
        16
      ],
      "n_estimators": [
        150,
        250
      ],
      "split_leaf_multiplier": [
        2
      ]
    }
  },
  "data": {
    "confirmatory_validation_used": false,
    "development_act": 152,
    "development_events": 465,
    "development_n": 1034,
    "former_validation_used_as_development": true,
    "reactome_collection_sha256": "5d61f289a2400cddfbb3a3353829fd2284a360bbe50f2093b566c4b7bea93341",
    "reactome_genes_before_smoke_reduction": 8647,
    "reactome_genes_used": 8647,
    "test_used": false,
    "train_sha256": "b93f3cee3858716bca8add447bc837c734e203f6cb37962b1081e3c118d2c65d",
    "validation_sha256": "824689aeaa34984727f2551bd512214164d0559d05cbec5817b0f88c9adb15a9"
  },
  "eligible": true,
  "final": {
    "clinical_covariates": [
      "Adjuvant Chemo",
      "Age",
      "IS_MALE",
      "Stage_IA",
      "Stage_IB",
      "Stage_II",
      "Stage_III",
      "Histology_Adenocarcinoma",
      "Histology_Adenosquamous Carcinoma",
      "Histology_Large Cell Carcinoma",
      "Histology_Squamous Cell Carcinoma",
      "Race_African American",
      "Race_Asian",
      "Race_Caucasian",
      "Race_Native Hawaiian or Other Pacific Islander",
      "Race_Unknown",
      "Smoked?_No",
      "Smoked?_Unknown",
      "Smoked?_Yes"
    ],
    "covariates": [
      "Adjuvant Chemo",
      "Age",
      "IS_MALE",
      "Stage_IA",
      "Stage_IB",
      "Stage_II",
      "Stage_III",
      "Histology_Adenocarcinoma",
      "Histology_Adenosquamous Carcinoma",
      "Histology_Large Cell Carcinoma",
      "Histology_Squamous Cell Carcinoma",
      "Race_African American",
      "Race_Asian",
      "Race_Caucasian",
      "Race_Native Hawaiian or Other Pacific Islander",
      "Race_Unknown",
      "Smoked?_No",
      "Smoked?_Unknown",
      "Smoked?_Yes",
      "LDLRAP1",
      "SEC23A",
      "GNG7",
      "ANKFY1",
      "PRIM2",
      "PPFIBP2",
      "INHA",
      "SLC24A1",
      "KCNS3",
      "P2RY10",
      "SLCO4A1",
      "DNM1L",
      "ARHGAP25",
      "LAMC2"
    ],
    "development_cv": {
      "folds": [
        {
          "act_recommended_fraction": 0.336231884057971,
          "fold": 1,
          "harrell_cindex": 0.7232417195207893,
          "rmst_difference_months": 4.165762425715095
        },
        {
          "act_recommended_fraction": 0.22608695652173913,
          "fold": 2,
          "harrell_cindex": 0.7269126364190349,
          "rmst_difference_months": 8.547116259547094
        },
        {
          "act_recommended_fraction": 0.16569767441860464,
          "fold": 3,
          "harrell_cindex": 0.7093528406065193,
          "rmst_difference_months": 3.5505353402714874
        }
      ],
      "harrell_cindex": 0.7189061365343198,
      "rmst_difference_months": 5.422947102000818
    },
    "genes": [
      "LDLRAP1",
      "SEC23A",
      "GNG7",
      "ANKFY1",
      "PRIM2",
      "PPFIBP2",
      "INHA",
      "SLC24A1",
      "KCNS3",
      "P2RY10",
      "SLCO4A1",
      "DNM1L",
      "ARHGAP25",
      "LAMC2"
    ],
    "rsf_params": {
      "max_depth": 8,
      "max_features": "sqrt",
      "min_samples_leaf": 16,
      "min_samples_split": 48,
      "n_estimators": 600
    },
    "top_n": 14
  },
  "limitations": [
    "Train and former validation are pooled adaptive development data; the reported CV scores are not external confirmation.",
    "The PFI ranking and reduced-model search reuse development folds, so final CV performance is selection-adaptive.",
    "Permutation importance is conditional on the fitted RSF and can divide credit unpredictably among correlated genes.",
    "Zero importance for a feature unused by every assessment-fold forest is exact for those fitted forests, not proof of no biological effect.",
    "IPCW-AIPW validity requires adequate measured-confounder adjustment, positivity, consistency, and conditionally independent censoring.",
    "Random row-level CV does not establish transportability across source studies or expression platforms."
  ],
  "objective": {
    "primary": "60-month cross-fitted IPCW-AIPW policy-versus-anti-policy RMST difference",
    "secondary": "Harrell C-index",
    "selection": "lexicographic with RMST first"
  },
  "permutation_importance": {
    "features_used_in_any_fold": 2848,
    "features_with_positive_rmst_importance": 0,
    "rank_rule": "RMST importance descending, C-index importance descending, symbol ascending",
    "repeats": 3,
    "top_32_genes": [
      "LDLRAP1",
      "SEC23A",
      "GNG7",
      "ANKFY1",
      "PRIM2",
      "PPFIBP2",
      "INHA",
      "SLC24A1",
      "KCNS3",
      "P2RY10",
      "SLCO4A1",
      "DNM1L",
      "ARHGAP25",
      "LAMC2",
      "ALDH9A1",
      "ZNF266",
      "GLS2",
      "PIK3R1",
      "BUB1",
      "UBE2E1",
      "GSPT2",
      "IGFBP1",
      "DEFA6",
      "TAB2",
      "IL18",
      "F2R",
      "ORC1",
      "FRAT1",
      "INTS14",
      "LPIN1",
      "TRIM24",
      "PCK1"
    ]
  },
  "phase": "pooled_development_cv_search",
  "reduced_search": {
    "best_trial": 44,
    "evaluated_top_n": [
      0,
      1,
      2,
      3,
      4,
      5,
      6,
      7,
      8,
      9,
      10,
      11,
      12,
      13,
      14,
      15,
      16,
      17,
      18,
      19,
      20,
      21,
      22,
      23,
      24,
      25,
      26,
      27,
      28,
      29,
      30,
      31,
      32
    ],
    "trials": [
      {
        "harrell_cindex": 0.6839594828602816,
        "rmst_difference_months": 3.1457011980154372,
        "rsf_max_depth": 8,
        "rsf_max_features": "sqrt",
        "rsf_min_samples_leaf": 8,
        "rsf_min_samples_split": 16,
        "rsf_n_estimators": 400,
        "stage": "reduced",
        "top_n": 0,
        "trial": 0
      },
      {
        "harrell_cindex": 0.6955333701595735,
        "rmst_difference_months": 2.216566172549207,
        "rsf_max_depth": 8,
        "rsf_max_features": "sqrt",
        "rsf_min_samples_leaf": 8,
        "rsf_min_samples_split": 16,
        "rsf_n_estimators": 400,
        "stage": "reduced",
        "top_n": 1,
        "trial": 1
      },
      {
        "harrell_cindex": 0.6972200326470825,
        "rmst_difference_months": 0.7440110307676054,
        "rsf_max_depth": 8,
        "rsf_max_features": "sqrt",
        "rsf_min_samples_leaf": 8,
        "rsf_min_samples_split": 16,
        "rsf_n_estimators": 400,
        "stage": "reduced",
        "top_n": 2,
        "trial": 2
      },
      {
        "harrell_cindex": 0.7019805482972001,
        "rmst_difference_months": 1.6148829547856367,
        "rsf_max_depth": 8,
        "rsf_max_features": "sqrt",
        "rsf_min_samples_leaf": 8,
        "rsf_min_samples_split": 16,
        "rsf_n_estimators": 400,
        "stage": "reduced",
        "top_n": 3,
        "trial": 3
      },
      {
        "harrell_cindex": 0.7087954716137962,
        "rmst_difference_months": 2.1596290927451496,
        "rsf_max_depth": 8,
        "rsf_max_features": "sqrt",
        "rsf_min_samples_leaf": 8,
        "rsf_min_samples_split": 16,
        "rsf_n_estimators": 400,
        "stage": "reduced",
        "top_n": 4,
        "trial": 4
      },
      {
        "harrell_cindex": 0.7076720644004046,
        "rmst_difference_months": 0.7286629743597256,
        "rsf_max_depth": 8,
        "rsf_max_features": "sqrt",
        "rsf_min_samples_leaf": 8,
        "rsf_min_samples_split": 16,
        "rsf_n_estimators": 400,
        "stage": "reduced",
        "top_n": 5,
        "trial": 5
      },
      {
        "harrell_cindex": 0.7089475350211337,
        "rmst_difference_months": 2.162118883442323,
        "rsf_max_depth": 8,
        "rsf_max_features": "sqrt",
        "rsf_min_samples_leaf": 8,
        "rsf_min_samples_split": 16,
        "rsf_n_estimators": 400,
        "stage": "reduced",
        "top_n": 6,
        "trial": 6
      },
      {
        "harrell_cindex": 0.7157283216544499,
        "rmst_difference_months": 1.651781477746135,
        "rsf_max_depth": 8,
        "rsf_max_features": "sqrt",
        "rsf_min_samples_leaf": 8,
        "rsf_min_samples_split": 16,
        "rsf_n_estimators": 400,
        "stage": "reduced",
        "top_n": 7,
        "trial": 7
      },
      {
        "harrell_cindex": 0.7158307317042895,
        "rmst_difference_months": 0.45554388752959984,
        "rsf_max_depth": 8,
        "rsf_max_features": "sqrt",
        "rsf_min_samples_leaf": 8,
        "rsf_min_samples_split": 16,
        "rsf_n_estimators": 400,
        "stage": "reduced",
        "top_n": 8,
        "trial": 8
      },
      {
        "harrell_cindex": 0.7164669153472322,
        "rmst_difference_months": 2.7803547073598454,
        "rsf_max_depth": 8,
        "rsf_max_features": "sqrt",
        "rsf_min_samples_leaf": 8,
        "rsf_min_samples_split": 16,
        "rsf_n_estimators": 400,
        "stage": "reduced",
        "top_n": 9,
        "trial": 9
      },
      {
        "harrell_cindex": 0.7214819044545269,
        "rmst_difference_months": -0.7194895838499618,
        "rsf_max_depth": 8,
        "rsf_max_features": "sqrt",
        "rsf_min_samples_leaf": 8,
        "rsf_min_samples_split": 16,
        "rsf_n_estimators": 400,
        "stage": "reduced",
        "top_n": 10,
        "trial": 10
      },
      {
        "harrell_cindex": 0.7220063680430991,
        "rmst_difference_months": 2.3573198396964226,
        "rsf_max_depth": 8,
        "rsf_max_features": "sqrt",
        "rsf_min_samples_leaf": 8,
        "rsf_min_samples_split": 16,
        "rsf_n_estimators": 400,
        "stage": "reduced",
        "top_n": 11,
        "trial": 11
      },
      {
        "harrell_cindex": 0.7211622609656336,
        "rmst_difference_months": 3.8911513978874925,
        "rsf_max_depth": 8,
        "rsf_max_features": "sqrt",
        "rsf_min_samples_leaf": 8,
        "rsf_min_samples_split": 16,
        "rsf_n_estimators": 400,
        "stage": "reduced",
        "top_n": 12,
        "trial": 12
      },
      {
        "harrell_cindex": 0.7211374342868847,
        "rmst_difference_months": 1.7549683413556487,
        "rsf_max_depth": 8,
        "rsf_max_features": "sqrt",
        "rsf_min_samples_leaf": 8,
        "rsf_min_samples_split": 16,
        "rsf_n_estimators": 400,
        "stage": "reduced",
        "top_n": 13,
        "trial": 13
      },
      {
        "harrell_cindex": 0.7223477348758977,
        "rmst_difference_months": 1.0292190004691621,
        "rsf_max_depth": 8,
        "rsf_max_features": "sqrt",
        "rsf_min_samples_leaf": 8,
        "rsf_min_samples_split": 16,
        "rsf_n_estimators": 400,
        "stage": "reduced",
        "top_n": 14,
        "trial": 14
      },
      {
        "harrell_cindex": 0.7203026372139502,
        "rmst_difference_months": 2.00396241384068,
        "rsf_max_depth": 8,
        "rsf_max_features": "sqrt",
        "rsf_min_samples_leaf": 8,
        "rsf_min_samples_split": 16,
        "rsf_n_estimators": 400,
        "stage": "reduced",
        "top_n": 15,
        "trial": 15
      },
      {
        "harrell_cindex": 0.7219691280249756,
        "rmst_difference_months": 1.7568110007947133,
        "rsf_max_depth": 8,
        "rsf_max_features": "sqrt",
        "rsf_min_samples_leaf": 8,
        "rsf_min_samples_split": 16,
        "rsf_n_estimators": 400,
        "stage": "reduced",
        "top_n": 16,
        "trial": 16
      },
      {
        "harrell_cindex": 0.7206346940422178,
        "rmst_difference_months": 3.625515557823062,
        "rsf_max_depth": 8,
        "rsf_max_features": "sqrt",
        "rsf_min_samples_leaf": 8,
        "rsf_min_samples_split": 16,
        "rsf_n_estimators": 400,
        "stage": "reduced",
        "top_n": 17,
        "trial": 17
      },
      {
        "harrell_cindex": 0.7231794286139885,
        "rmst_difference_months": 2.0105026609780805,
        "rsf_max_depth": 8,
        "rsf_max_features": "sqrt",
        "rsf_min_samples_leaf": 8,
        "rsf_min_samples_split": 16,
        "rsf_n_estimators": 400,
        "stage": "reduced",
        "top_n": 18,
        "trial": 18
      },
      {
        "harrell_cindex": 0.7221056747580951,
        "rmst_difference_months": 1.736245253140028,
        "rsf_max_depth": 8,
        "rsf_max_features": "sqrt",
        "rsf_min_samples_leaf": 8,
        "rsf_min_samples_split": 16,
        "rsf_n_estimators": 400,
        "stage": "reduced",
        "top_n": 19,
        "trial": 19
      },
      {
        "harrell_cindex": 0.7211001942687613,
        "rmst_difference_months": 1.6027657053447306,
        "rsf_max_depth": 8,
        "rsf_max_features": "sqrt",
        "rsf_min_samples_leaf": 8,
        "rsf_min_samples_split": 16,
        "rsf_n_estimators": 400,
        "stage": "reduced",
        "top_n": 20,
        "trial": 20
      },
      {
        "harrell_cindex": 0.7233376986910134,
        "rmst_difference_months": 0.11026373198642425,
        "rsf_max_depth": 8,
        "rsf_max_features": "sqrt",
        "rsf_min_samples_leaf": 8,
        "rsf_min_samples_split": 16,
        "rsf_n_estimators": 400,
        "stage": "reduced",
        "top_n": 21,
        "trial": 21
      },
      {
        "harrell_cindex": 0.7208519274812714,
        "rmst_difference_months": -0.2082605301230055,
        "rsf_max_depth": 8,
        "rsf_max_features": "sqrt",
        "rsf_min_samples_leaf": 8,
        "rsf_min_samples_split": 16,
        "rsf_n_estimators": 400,
        "stage": "reduced",
        "top_n": 22,
        "trial": 22
      },
      {
        "harrell_cindex": 0.7247497160448618,
        "rmst_difference_months": 0.8940866429258391,
        "rsf_max_depth": 8,
        "rsf_max_features": "sqrt",
        "rsf_min_samples_leaf": 8,
        "rsf_min_samples_split": 16,
        "rsf_n_estimators": 400,
        "stage": "reduced",
        "top_n": 23,
        "trial": 23
      },
      {
        "harrell_cindex": 0.7246690293389276,
        "rmst_difference_months": 1.4861536716503982,
        "rsf_max_depth": 8,
        "rsf_max_features": "sqrt",
        "rsf_min_samples_leaf": 8,
        "rsf_min_samples_split": 16,
        "rsf_n_estimators": 400,
        "stage": "reduced",
        "top_n": 24,
        "trial": 24
      },
      {
        "harrell_cindex": 0.7233035620077335,
        "rmst_difference_months": -1.3520143276592962,
        "rsf_max_depth": 8,
        "rsf_max_features": "sqrt",
        "rsf_min_samples_leaf": 8,
        "rsf_min_samples_split": 16,
        "rsf_n_estimators": 400,
        "stage": "reduced",
        "top_n": 25,
        "trial": 25
      },
      {
        "harrell_cindex": 0.7259041566066895,
        "rmst_difference_months": 1.149739965672531,
        "rsf_max_depth": 8,
        "rsf_max_features": "sqrt",
        "rsf_min_samples_leaf": 8,
        "rsf_min_samples_split": 16,
        "rsf_n_estimators": 400,
        "stage": "reduced",
        "top_n": 26,
        "trial": 26
      },
      {
        "harrell_cindex": 0.7260841500276197,
        "rmst_difference_months": -0.6906424799336234,
        "rsf_max_depth": 8,
        "rsf_max_features": "sqrt",
        "rsf_min_samples_leaf": 8,
        "rsf_min_samples_split": 16,
        "rsf_n_estimators": 400,
        "stage": "reduced",
        "top_n": 27,
        "trial": 27
      },
      {
        "harrell_cindex": 0.7275240973950607,
        "rmst_difference_months": 2.6355189667837773,
        "rsf_max_depth": 8,
        "rsf_max_features": "sqrt",
        "rsf_min_samples_leaf": 8,
        "rsf_min_samples_split": 16,
        "rsf_n_estimators": 400,
        "stage": "reduced",
        "top_n": 28,
        "trial": 28
      },
      {
        "harrell_cindex": 0.7260996667018378,
        "rmst_difference_months": 0.45243816373390067,
        "rsf_max_depth": 8,
        "rsf_max_features": "sqrt",
        "rsf_min_samples_leaf": 8,
        "rsf_min_samples_split": 16,
        "rsf_n_estimators": 400,
        "stage": "reduced",
        "top_n": 29,
        "trial": 29
      },
      {
        "harrell_cindex": 0.7273503106438178,
        "rmst_difference_months": -0.11254287537365303,
        "rsf_max_depth": 8,
        "rsf_max_features": "sqrt",
        "rsf_min_samples_leaf": 8,
        "rsf_min_samples_split": 16,
        "rsf_n_estimators": 400,
        "stage": "reduced",
        "top_n": 30,
        "trial": 30
      },
      {
        "harrell_cindex": 0.7270151504807065,
        "rmst_difference_months": -1.4554665035167038,
        "rsf_max_depth": 8,
        "rsf_max_features": "sqrt",
        "rsf_min_samples_leaf": 8,
        "rsf_min_samples_split": 16,
        "rsf_n_estimators": 400,
        "stage": "reduced",
        "top_n": 31,
        "trial": 31
      },
      {
        "harrell_cindex": 0.7256683031585742,
        "rmst_difference_months": 0.5337932560549348,
        "rsf_max_depth": 8,
        "rsf_max_features": "sqrt",
        "rsf_min_samples_leaf": 8,
        "rsf_min_samples_split": 16,
        "rsf_n_estimators": 400,
        "stage": "reduced",
        "top_n": 32,
        "trial": 32
      },
      {
        "harrell_cindex": 0.6960500754110367,
        "rmst_difference_months": 2.090900861781172,
        "rsf_max_depth": 6,
        "rsf_max_features": 0.25,
        "rsf_min_samples_leaf": 32,
        "rsf_min_samples_split": 96,
        "rsf_n_estimators": 400,
        "stage": "reduced",
        "top_n": 3,
        "trial": 33
      },
      {
        "harrell_cindex": 0.7099095688226569,
        "rmst_difference_months": 2.5845252194607524,
        "rsf_max_depth": 4,
        "rsf_max_features": "sqrt",
        "rsf_min_samples_leaf": 16,
        "rsf_min_samples_split": 32,
        "rsf_n_estimators": 400,
        "stage": "reduced",
        "top_n": 7,
        "trial": 34
      },
      {
        "harrell_cindex": 0.6840960295934011,
        "rmst_difference_months": 3.4362255227137126,
        "rsf_max_depth": 8,
        "rsf_max_features": "sqrt",
        "rsf_min_samples_leaf": 8,
        "rsf_min_samples_split": 16,
        "rsf_n_estimators": 600,
        "stage": "reduced",
        "top_n": 0,
        "trial": 35
      },
      {
        "harrell_cindex": 0.7088761583197304,
        "rmst_difference_months": -0.089215158925622,
        "rsf_max_depth": 8,
        "rsf_max_features": "sqrt",
        "rsf_min_samples_leaf": 32,
        "rsf_min_samples_split": 96,
        "rsf_n_estimators": 400,
        "stage": "reduced",
        "top_n": 9,
        "trial": 36
      },
      {
        "harrell_cindex": 0.7086961648988003,
        "rmst_difference_months": 0.28904385953272993,
        "rsf_max_depth": 8,
        "rsf_max_features": "sqrt",
        "rsf_min_samples_leaf": 8,
        "rsf_min_samples_split": 16,
        "rsf_n_estimators": 200,
        "stage": "reduced",
        "top_n": 6,
        "trial": 37
      },
      {
        "harrell_cindex": 0.6973038226878604,
        "rmst_difference_months": -0.3019062147919175,
        "rsf_max_depth": 4,
        "rsf_max_features": 0.25,
        "rsf_min_samples_leaf": 8,
        "rsf_min_samples_split": 16,
        "rsf_n_estimators": 400,
        "stage": "reduced",
        "top_n": 3,
        "trial": 38
      },
      {
        "harrell_cindex": 0.7072143225109703,
        "rmst_difference_months": 0.21834611561134748,
        "rsf_max_depth": 4,
        "rsf_max_features": 0.25,
        "rsf_min_samples_leaf": 32,
        "rsf_min_samples_split": 96,
        "rsf_n_estimators": 200,
        "stage": "reduced",
        "top_n": 28,
        "trial": 39
      },
      {
        "harrell_cindex": 0.7247497160448618,
        "rmst_difference_months": 0.