[I 2026-08-22 21:36:35,977] Trial 40 finished with values: [0.8940866429258391, 0.7247497160448618] and parameters: {'top_n': 23, 'n_estimators': 400, 'max_depth': 8, 'min_samples_leaf': 8, 'split_leaf_multiplier': 2, 'max_features': 'sqrt'}.
[reduced trial 041] N=21 RMST=1.0247 C=0.7172 params={'n_estimators': 200, 'max_depth': 4, 'min_samples_leaf': 8, 'min_samples_split': 24, 'max_features': 'sqrt'}
[I 2026-08-22 21:36:37,522] Trial 41 finished with values: [1.0246820464695263, 0.7172117157097017] and parameters: {'top_n': 21, 'n_estimators': 200, 'max_depth': 4, 'min_samples_leaf': 8, 'split_leaf_multiplier': 3, 'max_features': 'sqrt'}.
[reduced trial 042] N=24 RMST=1.4564 C=0.7255 params={'n_estimators': 600, 'max_depth': 8, 'min_samples_leaf': 8, 'min_samples_split': 24, 'max_features': 'sqrt'}
[I 2026-08-22 21:36:41,136] Trial 42 finished with values: [1.4563662057920834, 0.7254541730543642] and parameters: {'top_n': 24, 'n_estimators': 600, 'max_depth': 8, 'min_samples_leaf': 8, 'split_leaf_multiplier': 3, 'max_features': 'sqrt'}.
[reduced trial 043] N=27 RMST=0.7890 C=0.7268 params={'n_estimators': 200, 'max_depth': 6, 'min_samples_leaf': 8, 'min_samples_split': 16, 'max_features': 'log2'}
[I 2026-08-22 21:36:42,789] Trial 43 finished with values: [0.7889799281168851, 0.7268041237113402] and parameters: {'top_n': 27, 'n_estimators': 200, 'max_depth': 6, 'min_samples_leaf': 8, 'split_leaf_multiplier': 2, 'max_features': 'log2'}.
[reduced trial 044] N=14 RMST=5.4229 C=0.7189 params={'n_estimators': 600, 'max_depth': 8, 'min_samples_leaf': 16, 'min_samples_split': 48, 'max_features': 'sqrt'}
[I 2026-08-22 21:36:45,572] Trial 44 finished with values: [5.422947102000818, 0.7189061365343198] and parameters: {'top_n': 14, 'n_estimators': 600, 'max_depth': 8, 'min_samples_leaf': 16, 'split_leaf_multiplier': 3, 'max_features': 'sqrt'}.
[reduced trial 045] N=32 RMST=0.8855 C=0.7216 params={'n_estimators': 400, 'max_depth': 6, 'min_samples_leaf': 16, 'min_samples_split': 32, 'max_features': 'sqrt'}
[I 2026-08-22 21:36:48,183] Trial 45 finished with values: [0.8854552994582184, 0.7216432778663953] and parameters: {'top_n': 32, 'n_estimators': 400, 'max_depth': 6, 'min_samples_leaf': 16, 'split_leaf_multiplier': 2, 'max_features': 'sqrt'}.
[reduced trial 046] N=27 RMST=1.0234 C=0.7215 params={'n_estimators': 400, 'max_depth': 6, 'min_samples_leaf': 8, 'min_samples_split': 16, 'max_features': 0.25}
[I 2026-08-22 21:36:51,612] Trial 46 finished with values: [1.0234367136263622, 0.7215284544771812] and parameters: {'top_n': 27, 'n_estimators': 400, 'max_depth': 6, 'min_samples_leaf': 8, 'split_leaf_multiplier': 2, 'max_features': 0.25}.
[reduced trial 047] N=22 RMST=-0.1258 C=0.7182 params={'n_estimators': 400, 'max_depth': 4, 'min_samples_leaf': 8, 'min_samples_split': 24, 'max_features': 'log2'}
[I 2026-08-22 21:36:53,830] Trial 47 finished with values: [-0.12582146906941874, 0.7181675428415375] and parameters: {'top_n': 22, 'n_estimators': 400, 'max_depth': 4, 'min_samples_leaf': 8, 'split_leaf_multiplier': 3, 'max_features': 'log2'}.
[reduced trial 048] N=00 RMST=1.8669 C=0.6831 params={'n_estimators': 600, 'max_depth': 4, 'min_samples_leaf': 16, 'min_samples_split': 48, 'max_features': 0.25}
