[I 2026-08-22 19:31:05,528] A new study created in memory with name: no-name-79ae50b3-eb40-4898-9657-b6ad2be9f7f8
[screening trial 000] RMST=0.2183 C=0.6708 params={'n_estimators': 250, 'max_depth': 4, 'min_samples_leaf': 16, 'min_samples_split': 32, 'max_features': 0.25}
[I 2026-08-22 19:35:58,130] Trial 0 finished with values: [0.21834611561134748, 0.6707625514377751] and parameters: {'n_estimators': 250, 'max_depth': 4, 'min_samples_leaf': 16, 'split_leaf_multiplier': 2, 'max_features': 0.25}.
[screening trial 001] RMST=0.2183 C=0.6653 params={'n_estimators': 250, 'max_depth': 6, 'min_samples_leaf': 16, 'min_samples_split': 32, 'max_features': 0.5}
[I 2026-08-22 19:48:18,604] Trial 1 finished with values: [0.21834611561134748, 0.6653068887826858] and parameters: {'n_estimators': 250, 'max_depth': 6, 'min_samples_leaf': 16, 'split_leaf_multiplier': 2, 'max_features': 0.5}.
[screening trial 002] RMST=0.2183 C=0.6619 params={'n_estimators': 150, 'max_depth': 6, 'min_samples_leaf': 16, 'min_samples_split': 32, 'max_features': 0.5}
[I 2026-08-22 19:55:44,612] Trial 2 finished with values: [0.21834611561134748, 0.6619025304592315] and parameters: {'n_estimators': 150, 'max_depth': 6, 'min_samples_leaf': 16, 'split_leaf_multiplier': 2, 'max_features': 0.5}.
[screening trial 003] RMST=0.2183 C=0.6607 params={'n_estimators': 150, 'max_depth': 4, 'min_samples_leaf': 16, 'min_samples_split': 32, 'max_features': 0.5}
[I 2026-08-22 20:01:26,965] Trial 3 finished with values: [0.21834611561134748, 0.6607015398747494] and parameters: {'n_estimators': 150, 'max_depth': 4, 'min_samples_leaf': 16, 'split_leaf_multiplier': 2, 'max_features': 0.5}.
[screening trial 004] RMST=0.2183 C=0.6673 params={'n_estimators': 250, 'max_depth': 6, 'min_samples_leaf': 16, 'min_samples_split': 32, 'max_features': 0.25}
[I 2026-08-22 20:07:29,306] Trial 4 finished with values: [0.21834611561134748, 0.6672945747500264] and parameters: {'n_estimators': 250, 'max_depth': 6, 'min_samples_leaf': 16, 'split_leaf_multiplier': 2, 'max_features': 0.25}.
[screening trial 005] RMST=0.2183 C=0.6641 params={'n_estimators': 150, 'max_depth': 6, 'min_samples_leaf': 16, 'min_samples_split': 32, 'max_features': 0.25}
[I 2026-08-22 20:11:07,540] Trial 5 finished with values: [0.21834611561134748, 0.6640702098475021] and parameters: {'n_estimators': 150, 'max_depth': 6, 'min_samples_leaf': 16, 'split_leaf_multiplier': 2, 'max_features': 0.25}.
[screening trial 006] RMST=0.2183 C=0.6607 params={'n_estimators': 150, 'max_depth': 4, 'min_samples_leaf': 16, 'min_samples_split': 32, 'max_features': 0.5}
[I 2026-08-22 20:16:49,813] Trial 6 finished with values: [0.21834611561134748, 0.6607015398747494] and parameters: {'n_estimators': 150, 'max_depth': 4, 'min_samples_leaf': 16, 'split_leaf_multiplier': 2, 'max_features': 0.5}.
[screening trial 007] RMST=0.2183 C=0.6653 params={'n_estimators': 250, 'max_depth': 6, 'min_samples_leaf': 16, 'min_samples_split': 32, 'max_features': 0.5}
[I 2026-08-22 20:29:13,315] Trial 7 finished with values: [0.21834611561134748, 0.6653068887826858] and parameters: {'n_estimators': 250, 'max_depth': 6, 'min_samples_leaf': 16, 'split_leaf_multiplier': 2, 'max_features': 0.5}.
[screening trial 008] RMST=0.2183 C=0.6680 params={'n_estimators': 150, 'max_depth': 4, 'min_samples_leaf': 16, 'min_samples_split': 32, 'max_features': 0.25}
[I 2026-08-22 20:32:01,132] Trial 8 finished with values: [0.21834611561134748, 0.668022306770856] and parameters: {'n_estimators': 150, 'max_depth': 4, 'min_samples_leaf': 16, 'split_leaf_multiplier': 2, 'max_features': 0.25}.
[screening trial 009] RMST=0.2183 C=0.6653 params={'n_estimators': 250, 'max_depth': 6, 'min_samples_leaf': 16, 'min_samples_split': 32, 'max_features': 0.5}
[I 2026-08-22 20:44:24,331] Trial 9 finished with values: [0.21834611561134748, 0.6653068887826858] and parameters: {'n_estimators': 250, 'max_depth': 6, 'min_samples_leaf': 16, 'split_leaf_multiplier': 2, 'max_features': 0.5}.
[screening trial 010] RMST=0.2183 C=0.6607 params={'n_estimators': 150, 'max_depth': 4, 'min_samples_leaf': 16, 'min_samples_split': 32, 'max_features': 0.5}
[I 2026-08-22 20:49:52,069] Trial 10 finished with values: [0.21834611561134748, 0.6607015398747494] and parameters: {'n_estimators': 150, 'max_depth': 4, 'min_samples_leaf': 16, 'split_leaf_multiplier': 2, 'max_features': 0.5}.
[screening trial 011] RMST=0.2183 C=0.6673 params={'n_estimators': 250, 'max_depth': 6, 'min_samples_leaf': 16, 'min_samples_split': 32, 'max_features': 0.25}
[I 2026-08-22 20:55:34,935] Trial 11 finished with values: [0.21834611561134748, 0.6672945747500264] and parameters: {'n_estimators': 250, 'max_depth': 6, 'min_samples_leaf': 16, 'split_leaf_multiplier': 2, 'max_features': 0.25}.
[PFI fold 1] 1114/8666 features used by a split
[PFI fold 2] 1289/8666 features used by a split
[PFI fold 2] processed through feature 1000
[PFI fold 2] processed through feature 3250
[PFI fold 2] processed through feature 3750
[PFI fold 2] processed through feature 7750
[PFI fold 3] 1069/8666 features used by a split
[PFI fold 3] processed through feature 1250
[PFI fold 3] processed through feature 3500
[PFI fold 3] processed through feature 5500
[I 2026-08-22 21:35:02,758] A new study created in memory with name: no-name-be799c76-7453-456c-9ccc-8569234229f2
[reduced trial 000] N=00 RMST=3.1457 C=0.6840 params={'n_estimators': 400, 'max_depth': 8, 'min_samples_leaf': 8, 'min_samples_split': 16, 'max_features': 'sqrt'}
[I 2026-08-22 21:35:04,497] Trial 0 finished with values: [3.1457011980154372, 0.6839594828602816] and parameters: {'top_n': 0, 'n_estimators': 400, 'max_depth': 8, 'min_samples_leaf': 8, 'split_leaf_multiplier': 2, 'max_features': 'sqrt'}.
[reduced trial 001] N=01 RMST=2.2166 C=0.6955 params={'n_estimators': 400, 'max_depth': 8, 'min_samples_leaf': 8, 'min_samples_split': 16, 'max_features': 'sqrt'}
[I 2026-08-22 21:35:06,289] Trial 1 finished with values: [2.216566172549207, 0.6955333701595735] and parameters: {'top_n': 1, 'n_estimators': 400, 'max_depth': 8, 'min_samples_leaf': 8, 'split_leaf_multiplier': 2, 'max_features': 'sqrt'}.
[reduced trial 002] N=02 RMST=0.7440 C=0.6972 params={'n_estimators': 400, 'max_depth': 8, 'min_samples_leaf': 8, 'min_samples_split': 16, 'max_features': 'sqrt'}
[I 2026-08-22 21:35:08,119] Trial 2 finished with values: [0.7440110307676054, 0.6972200326470825] and parameters: {'top_n': 2, 'n_estimators': 400, 'max_depth': 8, 'min_samples_leaf': 8, 'split_leaf_multiplier': 2, 'max_features': 'sqrt'}.
[reduced trial 003] N=03 RMST=1.6149 C=0.7020 params={'n_estimators': 400, 'max_depth': 8, 'min_samples_leaf': 8, 'min_samples_split': 16, 'max_features': 'sqrt'}
[I 2026-08-22 21:35:09,959] Trial 3 finished with values: [1.6148829547856367, 0.7019805482972001] and parameters: {'top_n': 3, 'n_estimators': 400, 'max_depth': 8, 'min_samples_leaf': 8, 'split_leaf_multiplier': 2, 'max_features': 'sqrt'}.
[reduced trial 004] N=04 RMST=2.1596 C=0.7088 params={'n_estimators': 400, 'max_depth': 8, 'min_samples_leaf': 8, 'min_samples_split': 16, 'max_features': 'sqrt'}
[I 2026-08-22 21:35:11,815] Trial 4 finished with values: [2.1596290927451496, 0.7087954716137962] and parameters: {'top_n': 4, 'n_estimators': 400, 'max_depth': 8, 'min_samples_leaf': 8, 'split_leaf_multiplier': 2, 'max_features': 'sqrt'}.
[reduced trial 005] N=05 RMST=0.7287 C=0.7077 params={'n_estimators': 400, 'max_depth': 8, 'min_samples_leaf': 8, 'min_samples_split': 16, 'max_features': 'sqrt'}
[I 2026-08-22 21:35:13,684] Trial 5 finished with values: [0.7286629743597256, 0.7076720644004046] and parameters: {'top_n': 5, 'n_estimators': 400, 'max_depth': 8, 'min_samples_leaf': 8, 'split_leaf_multiplier': 2, 'max_features': 'sqrt'}.
[reduced trial 006] N=06 RMST=2.1621 C=0.7089 params={'n_estimators': 400, 'max_depth': 8, 'min_samples_leaf': 8, 'min_samples_split': 16, 'max_features': 'sqrt'}
[I 2026-08-22 21:35:15,623] Trial 6 finished with values: [2.162118883442323, 0.7089475350211337] and parameters: {'top_n': 6, 'n_estimators': 400, 'max_depth': 8, 'min_samples_leaf': 8, 'split_leaf_multiplier': 2, 'max_features': 'sqrt'}.
[reduced trial 007] N=07 RMST=1.6518 C=0.7157 params={'n_estimators': 400, 'max_depth': 8, 'min_samples_leaf': 8, 'min_samples_split': 16, 'max_features': 'sqrt'}
[I 2026-08-22 21:35:17,621] Trial 7 finished with values: [1.651781477746135, 0.7157283216544499] and parameters: {'top_n': 7, 'n_estimators': 400, 'max_depth': 8, 'min_samples_leaf': 8, 'split_leaf_multiplier': 2, 'max_features': 'sqrt'}.
[reduced trial 008] N=08 RMST=0.4555 C=0.7158 params={'n_estimators': 400, 'max_depth': 8, 'min_samples_leaf': 8, 'min_samples_split': 16, 'max_features': 'sqrt'}
[I 2026-08-22 21:35:19,630] Trial 8 finished with values: [0.45554388752959984, 0.7158307317042895] and parameters: {'top_n': 8, 'n_estimators': 400, 'max_depth': 8, 'min_samples_leaf': 8, 'split_leaf_multiplier': 2, 'max_features': 'sqrt'}.
[reduced trial 009] N=09 RMST=2.7804 C=0.7165 params={'n_estimators': 400, 'max_depth': 8, 'min_samples_leaf': 8, 'min_samples_split': 16, 'max_features': 'sqrt'}
[I 2026-08-22 21:35:21,718] Trial 9 finished with values: [2.7803547073598454, 0.7164669153472322] and parameters: {'top_n': 9, 'n_estimators': 400, 'max_depth': 8, 'min_samples_leaf': 8, 'split_leaf_multiplier': 2, 'max_features': 'sqrt'}.
[reduced trial 010] N=10 RMST=-0.7195 C=0.7215 params={'n_estimators': 400, 'max_depth': 8, 'min_samples_leaf': 8, 'min_samples_split': 16, 'max_features': 'sqrt'}
[I 2026-08-22 21:35:23,777] Trial 10 finished with values: [-0.7194895838499618, 0.7214819044545269] and parameters: {'top_n': 10, 'n_estimators': 400, 'max_depth': 8, 'min_samples_leaf': 8, 'split_leaf_multiplier': 2, 'max_features': 'sqrt'}.
[reduced trial 011] N=11 RMST=2.3573 C=0.7220 params={'n_estimators': 400, 'max_depth': 8, 'min_samples_leaf': 8, 'min_samples_split': 16, 'max_features': 'sqrt'}
[I 2026-08-22 21:35:25,848] Trial 11 finished with values: [2.3573198396964226, 0.7220063680430991] and parameters: {'top_n': 11, 'n_estimators': 400, 'max_depth': 8, 'min_samples_leaf': 8, 'split_leaf_multiplier': 2, 'max_features': 'sqrt'}.
[reduced trial 012] N=12 RMST=3.8912 C=0.7212 params={'n_estimators': 400, 'max_depth': 8, 'min_samples_leaf': 8, 'min_samples_split': 16, 'max_features': 'sqrt'}
[I 2026-08-22 21:35:27,984] Trial 12 finished with values: [3.8911513978874925, 0.7211622609656336] and parameters: {'top_n': 12, 'n_estimators': 400, 'max_depth': 8, 'min_samples_leaf': 8, 'split_leaf_multiplier': 2, 'max_features': 'sqrt'}.
[reduced trial 013] N=13 RMST=1.7550 C=0.7211 params={'n_estimators': 400, 'max_depth': 8, 'min_samples_leaf': 8, 'min_samples_split': 16, 'max_features': 'sqrt'}
[I 2026-08-22 21:35:30,129] Trial 13 finished with values: [1.7549683413556487, 0.7211374342868847] and parameters: {'top_n': 13, 'n_estimators': 400, 'max_depth': 8, 'min_samples_leaf': 8, 'split_leaf_multiplier': 2, 'max_features': 'sqrt'}.
[reduced trial 014] N=14 RMST=1.0292 C=0.7223 params={'n_estimators': 400, 'max_depth': 8, 'min_samples_leaf': 8, 'min_samples_split': 16, 'max_features': 'sqrt'}
[I 2026-08-22 21:35:32,436] Trial 14 finished with values: [1.0292190004691621, 0.7223477348758977] and parameters: {'top_n': 14, 'n_estimators': 400, 'max_depth': 8, 'min_samples_leaf': 8, 'split_leaf_multiplier': 2, 'max_features': 'sqrt'}.
[reduced trial 015] N=15 RMST=2.0040 C=0.7203 params={'n_estimators': 400, 'max_depth': 8, 'min_samples_leaf': 8, 'min_samples_split': 16, 'max_features': 'sqrt'}
[I 2026-08-22 21:35:34,669] Trial 15 finished with values: [2.00396241384068, 0.7203026372139502] and parameters: {'top_n': 15, 'n_estimators': 400, 'max_depth': 8, 'min_samples_leaf': 8, 'split_leaf_multiplier': 2, 'max_features': 'sqrt'}.
[reduced trial 016] N=16 RMST=1.7568 C=0.7220 params={'n_estimators': 400, 'max_depth': 8, 'min_samples_leaf': 8, 'min_samples_split': 16, 'max_features': 'sqrt'}
[I 2026-08-22 21:35:36,938] Trial 16 finished with values: [1.7568110007947133, 0.7219691280249756] and parameters: {'top_n': 16, 'n_estimators': 400, 'max_depth': 8, 'min_samples_leaf': 8, 'split_leaf_multiplier': 2, 'max_features': 'sqrt'}.
[reduced trial 017] N=17 RMST=3.6255 C=0.7206 params={'n_estimators': 400, 'max_depth': 8, 'min_samples_leaf': 8, 'min_samples_split': 16, 'max_features': 'sqrt'}
[I 2026-08-22 21:35:39,368] Trial 17 finished with values: [3.625515557823062, 0.7206346940422178] and parameters: {'top_n': 17, 'n_estimators': 400, 'max_depth': 8, 'min_samples_leaf': 8, 'split_leaf_multiplier': 2, 'max_features': 'sqrt'}.
[reduced trial 018] N=18 RMST=2.0105 C=0.7232 params={'n_estimators': 400, 'max_depth': 8, 'min_samples_leaf': 8, 'min_samples_split': 16, 'max_features': 'sqrt'}
[I 2026-08-22 21:35:41,933] Trial 18 finished with values: [2.0105026609780805, 0.7231794286139885] and parameters: {'top_n': 18, 'n_estimators': 400, 'max_depth': 8, 'min_samples_leaf': 8, 'split_leaf_multiplier': 2, 'max_features': 'sqrt'}.
[reduced trial 019] N=19 RMST=1.7362 C=0.7221 params={'n_estimators': 400, 'max_depth': 8, 'min_samples_leaf': 8, 'min_samples_split': 16, 'max_features': 'sqrt'}
[I 2026-08-22 21:35:44,380] Trial 19 finished with values: [1.736245253140028, 0.7221056747580951] and parameters: {'top_n': 19, 'n_estimators': 400, 'max_depth': 8, 'min_samples_leaf': 8, 'split_leaf_multiplier': 2, 'max_features': 'sqrt'}.
[reduced trial 020] N=20 RMST=1.6028 C=0.7211 params={'n_estimators': 400, 'max_depth': 8, 'min_samples_leaf': 8, 'min_samples_split': 16, 'max_features': 'sqrt'}
[I 2026-08-22 21:35:46,899] Trial 20 finished with values: [1.6027657053447306, 0.7211001942687613] and parameters: {'top_n': 20, 'n_estimators': 400, 'max_depth': 8, 'min_samples_leaf': 8, 'split_leaf_multiplier': 2, 'max_features': 'sqrt'}.
[reduced trial 021] N=21 RMST=0.1103 C=0.7233 params={'n_estimators': 400, 'max_depth': 8, 'min_samples_leaf': 8, 'min_samples_split': 16, 'max_features': 'sqrt'}
[I 2026-08-22 21:35:49,485] Trial 21 finished with values: [0.11026373198642425, 0.7233376986910134] and parameters: {'top_n': 21, 'n_estimators': 400, 'max_depth': 8, 'min_samples_leaf': 8, 'split_leaf_multiplier': 2, 'max_features': 'sqrt'}.
[reduced trial 022] N=22 RMST=-0.2083 C=0.7209 params={'n_estimators': 400, 'max_depth': 8, 'min_samples_leaf': 8, 'min_samples_split': 16, 'max_features': 'sqrt'}
[I 2026-08-22 21:35:52,073] Trial 22 finished with values: [-0.2082605301230055, 0.7208519274812714] and parameters: {'top_n': 22, 'n_estimators': 400, 'max_depth': 8, 'min_samples_leaf': 8, 'split_leaf_multiplier': 2, 'max_features': 'sqrt'}.
[reduced trial 023] N=23 RMST=0.8941 C=0.7247 params={'n_estimators': 400, 'max_depth': 8, 'min_samples_leaf': 8, 'min_samples_split': 16, 'max_features': 'sqrt'}
[I 2026-08-22 21:35:54,689] Trial 23 finished with values: [0.8940866429258391, 0.7247497160448618] and parameters: {'top_n': 23, 'n_estimators': 400, 'max_depth': 8, 'min_samples_leaf': 8, 'split_leaf_multiplier': 2, 'max_features': 'sqrt'}.
[reduced trial 024] N=24 RMST=1.4862 C=0.7247 params={'n_estimators': 400, 'max_depth': 8, 'min_samples_leaf': 8, 'min_samples_split': 16, 'max_features': 'sqrt'}
[I 2026-08-22 21:35:57,319] Trial 24 finished with values: [1.4861536716503982, 0.7246690293389276] and parameters: {'top_n': 24, 'n_estimators': 400, 'max_depth': 8, 'min_samples_leaf': 8, 'split_leaf_multiplier': 2, 'max_features': 'sqrt'}.
[reduced trial 025] N=25 RMST=-1.3520 C=0.7233 params={'n_estimators': 400, 'max_depth': 8, 'min_samples_leaf': 8, 'min_samples_split': 16, 'max_features': 'sqrt'}
[I 2026-08-22 21:36:00,020] Trial 25 finished with values: [-1.3520143276592962, 0.7233035620077335] and parameters: {'top_n': 25, 'n_estimators': 400, 'max_depth': 8, 'min_samples_leaf': 8, 'split_leaf_multiplier': 2, 'max_features': 'sqrt'}.
[reduced trial 026] N=26 RMST=1.1497 C=0.7259 params={'n_estimators': 400, 'max_depth': 8, 'min_samples_leaf': 8, 'min_samples_split': 16, 'max_features': 'sqrt'}
[I 2026-08-22 21:36:02,719] Trial 26 finished with values: [1.149739965672531, 0.7259041566066895] and parameters: {'top_n': 26, 'n_estimators': 400, 'max_depth': 8, 'min_samples_leaf': 8, 'split_leaf_multiplier': 2, 'max_features': 'sqrt'}.
[reduced trial 027] N=27 RMST=-0.6906 C=0.7261 params={'n_estimators': 400, 'max_depth': 8, 'min_samples_leaf': 8, 'min_samples_split': 16, 'max_features': 'sqrt'}
[I 2026-08-22 21:36:05,436] Trial 27 finished with values: [-0.6906424799336234, 0.7260841500276197] and parameters: {'top_n': 27, 'n_estimators': 400, 'max_depth': 8, 'min_samples_leaf': 8, 'split_leaf_multiplier': 2, 'max_features': 'sqrt'}.
[reduced trial 028] N=28 RMST=2.6355 C=0.7275 params={'n_estimators': 400, 'max_depth': 8, 'min_samples_leaf': 8, 'min_samples_split': 16, 'max_features': 'sqrt'}
[I 2026-08-22 21:36:08,165] Trial 28 finished with values: [2.6355189667837773, 0.7275240973950607] and parameters: {'top_n': 28, 'n_estimators': 400, 'max_depth': 8, 'min_samples_leaf': 8, 'split_leaf_multiplier': 2, 'max_features': 'sqrt'}.
[reduced trial 029] N=29 RMST=0.4524 C=0.7261 params={'n_estimators': 400, 'max_depth': 8, 'min_samples_leaf': 8, 'min_samples_split': 16, 'max_features': 'sqrt'}
[I 2026-08-22 21:36:10,910] Trial 29 finished with values: [0.45243816373390067, 0.7260996667018378] and parameters: {'top_n': 29, 'n_estimators': 400, 'max_depth': 8, 'min_samples_leaf': 8, 'split_leaf_multiplier': 2, 'max_features': 'sqrt'}.
[reduced trial 030] N=30 RMST=-0.1125 C=0.7274 params={'n_estimators': 400, 'max_depth': 8, 'min_samples_leaf': 8, 'min_samples_split': 16, 'max_features': 'sqrt'}
[I 2026-08-22 21:36:13,927] Trial 30 finished with values: [-0.11254287537365303, 0.7273503106438178] and parameters: {'top_n': 30, 'n_estimators': 400, 'max_depth': 8, 'min_samples_leaf': 8, 'split_leaf_multiplier': 2, 'max_features': 'sqrt'}.
[reduced trial 031] N=31 RMST=-1.4555 C=0.7270 params={'n_estimators': 400, 'max_depth': 8, 'min_samples_leaf': 8, 'min_samples_split': 16, 'max_features': 'sqrt'}
[I 2026-08-22 21:36:16,896] Trial 31 finished with values: [-1.4554665035167038, 0.7270151504807065] and parameters: {'top_n': 31, 'n_estimators': 400, 'max_depth': 8, 'min_samples_leaf': 8, 'split_leaf_multiplier': 2, 'max_features': 'sqrt'}.
[reduced trial 032] N=32 RMST=0.5338 C=0.7257 params={'n_estimators': 400, 'max_depth': 8, 'min_samples_leaf': 8, 'min_samples_split': 16, 'max_features': 'sqrt'}
[I 2026-08-22 21:36:19,950] Trial 32 finished with values: [0.5337932560549348, 0.7256683031585742] and parameters: {'top_n': 32, 'n_estimators': 400, 'max_depth': 8, 'min_samples_leaf': 8, 'split_leaf_multiplier': 2, 'max_features': 'sqrt'}.
[reduced trial 033] N=03 RMST=2.0909 C=0.6961 params={'n_estimators': 400, 'max_depth': 6, 'min_samples_leaf': 32, 'min_samples_split': 96, 'max_features': 0.25}
[I 2026-08-22 21:36:21,934] Trial 33 finished with values: [2.090900861781172, 0.6960500754110367] and parameters: {'top_n': 3, 'n_estimators': 400, 'max_depth': 6, 'min_samples_leaf': 32, 'split_leaf_multiplier': 3, 'max_features': 0.25}.
[reduced trial 034] N=07 RMST=2.5845 C=0.7099 params={'n_estimators': 400, 'max_depth': 4, 'min_samples_leaf': 16, 'min_samples_split': 32, 'max_features': 'sqrt'}
[I 2026-08-22 21:36:23,963] Trial 34 finished with values: [2.5845252194607524, 0.7099095688226569] and parameters: {'top_n': 7, 'n_estimators': 400, 'max_depth': 4, 'min_samples_leaf': 16, 'split_leaf_multiplier': 2, 'max_features': 'sqrt'}.
[reduced trial 035] N=00 RMST=3.4362 C=0.6841 params={'n_estimators': 600, 'max_depth': 8, 'min_samples_leaf': 8, 'min_samples_split': 16, 'max_features': 'sqrt'}
[I 2026-08-22 21:36:26,190] Trial 35 finished with values: [3.4362255227137126, 0.6840960295934011] and parameters: {'top_n': 0, 'n_estimators': 600, 'max_depth': 8, 'min_samples_leaf': 8, 'split_leaf_multiplier': 2, 'max_features': 'sqrt'}.
[reduced trial 036] N=09 RMST=-0.0892 C=0.7089 params={'n_estimators': 400, 'max_depth': 8, 'min_samples_leaf': 32, 'min_samples_split': 96, 'max_features': 'sqrt'}
[I 2026-08-22 21:36:28,243] Trial 36 finished with values: [-0.089215158925622, 0.7088761583197304] and parameters: {'top_n': 9, 'n_estimators': 400, 'max_depth': 8, 'min_samples_leaf': 32, 'split_leaf_multiplier': 3, 'max_features': 'sqrt'}.
[reduced trial 037] N=06 RMST=0.2890 C=0.7087 params={'n_estimators': 200, 'max_depth': 8, 'min_samples_leaf': 8, 'min_samples_split': 16, 'max_features': 'sqrt'}
[I 2026-08-22 21:36:29,703] Trial 37 finished with values: [0.28904385953272993, 0.7086961648988003] and parameters: {'top_n': 6, 'n_estimators': 200, 'max_depth': 8, 'min_samples_leaf': 8, 'split_leaf_multiplier': 2, 'max_features': 'sqrt'}.
[reduced trial 038] N=03 RMST=-0.3019 C=0.6973 params={'n_estimators': 400, 'max_depth': 4, 'min_samples_leaf': 8, 'min_samples_split': 16, 'max_features': 0.25}
[I 2026-08-22 21:36:31,643] Trial 38 finished with values: [-0.3019062147919175, 0.6973038226878604] and parameters: {'top_n': 3, 'n_estimators': 400, 'max_depth': 4, 'min_samples_leaf': 8, 'split_leaf_multiplier': 2, 'max_features': 0.25}.
[reduced trial 039] N=28 RMST=0.2183 C=0.7072 params={'n_estimators': 200, 'max_depth': 4, 'min_samples_leaf': 32, 'min_samples_split': 96, 'max_features': 0.25}
[I 2026-08-22 21:36:33,353] Trial 39 finished with values: [0.21834611561134748, 0.7072143225109703] and parameters: {'top_n': 28, 'n_estimators': 200, 'max_depth': 4, 'min_samples_leaf': 32, 'split_leaf_multiplier': 3, 'max_features': 0.25}.
[reduced trial 040] N=23 RMST=0.8941 C=0.7247 params={'n_estimators': 400, 'max_depth': 8, 'min_samples_leaf': 8, 'min_samples_split': 16, 'max_features': 'sqrt'}
