[I 2026-08-22 16:38:22,531] A new study created in memory with name: no-name-ac576f74-c9d0-47c0-b85f-753796f3626b
[screening trial 000] RMST=0.2183 C=0.6680 params={'n_estimators': 150, 'max_depth': 4, 'min_samples_leaf': 16, 'min_samples_split': 32, 'max_features': 0.25}
[I 2026-08-22 16:41:18,529] Trial 0 finished with values: [0.21834611561134748, 0.668022306770856] and parameters: {'n_estimators': 150, 'max_depth': 4, 'min_samples_leaf': 16, 'split_leaf_multiplier': 2, 'max_features': 0.25}.
[screening trial 001] RMST=0.2183 C=0.6641 params={'n_estimators': 150, 'max_depth': 6, 'min_samples_leaf': 16, 'min_samples_split': 32, 'max_features': 0.25}
[I 2026-08-22 16:45:00,798] Trial 1 finished with values: [0.21834611561134748, 0.6640702098475021] and parameters: {'n_estimators': 150, 'max_depth': 6, 'min_samples_leaf': 16, 'split_leaf_multiplier': 2, 'max_features': 0.25}.
[screening trial 002] RMST=0.2183 C=0.6680 params={'n_estimators': 150, 'max_depth': 4, 'min_samples_leaf': 16, 'min_samples_split': 32, 'max_features': 0.25}
[I 2026-08-22 16:47:50,805] Trial 2 finished with values: [0.21834611561134748, 0.668022306770856] and parameters: {'n_estimators': 150, 'max_depth': 4, 'min_samples_leaf': 16, 'split_leaf_multiplier': 2, 'max_features': 0.25}.
[screening trial 003] RMST=0.2183 C=0.6562 params={'n_estimators': 150, 'max_depth': 6, 'min_samples_leaf': 16, 'min_samples_split': 32, 'max_features': 0.05}
[I 2026-08-22 16:48:33,040] Trial 3 finished with values: [0.21834611561134748, 0.6562063593537616] and parameters: {'n_estimators': 150, 'max_depth': 6, 'min_samples_leaf': 16, 'split_leaf_multiplier': 2, 'max_features': 0.05}.
[screening trial 004] RMST=0.2183 C=0.6557 params={'n_estimators': 150, 'max_depth': 4, 'min_samples_leaf': 16, 'min_samples_split': 32, 'max_features': 0.05}
[I 2026-08-22 16:49:06,727] Trial 4 finished with values: [0.21834611561134748, 0.6556694824258148] and parameters: {'n_estimators': 150, 'max_depth': 4, 'min_samples_leaf': 16, 'split_leaf_multiplier': 2, 'max_features': 0.05}.
[screening trial 005] RMST=0.2183 C=0.6668 params={'n_estimators': 150, 'max_depth': 6, 'min_samples_leaf': 24, 'min_samples_split': 48, 'max_features': 0.25}
[I 2026-08-22 16:52:06,268] Trial 5 finished with values: [0.21834611561134748, 0.6668228678537957] and parameters: {'n_estimators': 150, 'max_depth': 6, 'min_samples_leaf': 24, 'split_leaf_multiplier': 2, 'max_features': 0.25}.
[screening trial 006] RMST=0.2183 C=0.6680 params={'n_estimators': 100, 'max_depth': 4, 'min_samples_leaf': 16, 'min_samples_split': 32, 'max_features': 0.25}
[I 2026-08-22 16:54:03,660] Trial 6 finished with values: [0.21834611561134748, 0.6680067900966379] and parameters: {'n_estimators': 100, 'max_depth': 4, 'min_samples_leaf': 16, 'split_leaf_multiplier': 2, 'max_features': 0.25}.
[screening trial 007] RMST=0.2183 C=0.6562 params={'n_estimators': 150, 'max_depth': 6, 'min_samples_leaf': 16, 'min_samples_split': 32, 'max_features': 0.05}
[I 2026-08-22 16:54:45,668] Trial 7 finished with values: [0.21834611561134748, 0.6562063593537616] and parameters: {'n_estimators': 150, 'max_depth': 6, 'min_samples_leaf': 16, 'split_leaf_multiplier': 2, 'max_features': 0.05}.
[screening trial 008] RMST=0.2183 C=0.6528 params={'n_estimators': 150, 'max_depth': 6, 'min_samples_leaf': 24, 'min_samples_split': 48, 'max_features': 0.05}
[I 2026-08-22 16:55:19,579] Trial 8 finished with values: [0.21834611561134748, 0.6528128627022598] and parameters: {'n_estimators': 150, 'max_depth': 6, 'min_samples_leaf': 24, 'split_leaf_multiplier': 2, 'max_features': 0.05}.
[screening trial 009] RMST=0.2183 C=0.6562 params={'n_estimators': 150, 'max_depth': 6, 'min_samples_leaf': 16, 'min_samples_split': 32, 'max_features': 0.05}
[I 2026-08-22 16:56:01,571] Trial 9 finished with values: [0.21834611561134748, 0.6562063593537616] and parameters: {'n_estimators': 150, 'max_depth': 6, 'min_samples_leaf': 16, 'split_leaf_multiplier': 2, 'max_features': 0.05}.
[screening trial 010] RMST=0.2183 C=0.6498 params={'n_estimators': 100, 'max_depth': 4, 'min_samples_leaf': 24, 'min_samples_split': 48, 'max_features': 0.05}
[I 2026-08-22 16:56:22,273] Trial 10 finished with values: [0.21834611561134748, 0.6498274545826945] and parameters: {'n_estimators': 100, 'max_depth': 4, 'min_samples_leaf': 24, 'split_leaf_multiplier': 2, 'max_features': 0.05}.
[screening trial 011] RMST=0.2183 C=0.6513 params={'n_estimators': 100, 'max_depth': 6, 'min_samples_leaf': 16, 'min_samples_split': 32, 'max_features': 0.05}
[I 2026-08-22 16:56:51,880] Trial 11 finished with values: [0.21834611561134748, 0.651281366956932] and parameters: {'n_estimators': 100, 'max_depth': 6, 'min_samples_leaf': 16, 'split_leaf_multiplier': 2, 'max_features': 0.05}.
[PFI fold 1] 734/8666 features used by a split
[PFI fold 2] 820/8666 features used by a split
[PFI fold 2] processed through feature 1000
[PFI fold 3] 714/8666 features used by a split
[PFI fold 3] processed through feature 1250
[PFI fold 3] processed through feature 5500
[I 2026-08-22 17:16:56,347] A new study created in memory with name: no-name-6d8afd6a-4936-4e8d-8b07-c510bcab2c11
[reduced trial 000] N=00 RMST=3.3950 C=0.6825 params={'n_estimators': 400, 'max_depth': 6, 'min_samples_leaf': 16, 'min_samples_split': 32, 'max_features': 'sqrt'}
[I 2026-08-22 17:16:58,181] Trial 0 finished with values: [3.394965377171216, 0.6825071221534661] and parameters: {'top_n': 0, 'n_estimators': 400, 'max_depth': 6, 'min_samples_leaf': 16, 'split_leaf_multiplier': 2, 'max_features': 'sqrt'}.
[reduced trial 001] N=01 RMST=2.9319 C=0.6965 params={'n_estimators': 400, 'max_depth': 6, 'min_samples_leaf': 16, 'min_samples_split': 32, 'max_features': 'sqrt'}
[I 2026-08-22 17:17:00,056] Trial 1 finished with values: [2.9318922650807604, 0.696541953983751] and parameters: {'top_n': 1, 'n_estimators': 400, 'max_depth': 6, 'min_samples_leaf': 16, 'split_leaf_multiplier': 2, 'max_features': 'sqrt'}.
[reduced trial 002] N=02 RMST=2.1235 C=0.6953 params={'n_estimators': 400, 'max_depth': 6, 'min_samples_leaf': 16, 'min_samples_split': 32, 'max_features': 'sqrt'}
[I 2026-08-22 17:17:01,972] Trial 2 finished with values: [2.1234836613637773, 0.6953238950576289] and parameters: {'top_n': 2, 'n_estimators': 400, 'max_depth': 6, 'min_samples_leaf': 16, 'split_leaf_multiplier': 2, 'max_features': 'sqrt'}.
[reduced trial 003] N=03 RMST=3.6810 C=0.6992 params={'n_estimators': 400, 'max_depth': 6, 'min_samples_leaf': 16, 'min_samples_split': 32, 'max_features': 'sqrt'}
[I 2026-08-22 17:17:03,935] Trial 3 finished with values: [3.681005463881185, 0.699175133598565] and parameters: {'top_n': 3, 'n_estimators': 400, 'max_depth': 6, 'min_samples_leaf': 16, 'split_leaf_multiplier': 2, 'max_features': 'sqrt'}.
[reduced trial 004] N=04 RMST=1.9724 C=0.7055 params={'n_estimators': 400, 'max_depth': 6, 'min_samples_leaf': 16, 'min_samples_split': 32, 'max_features': 'sqrt'}
[I 2026-08-22 17:17:05,877] Trial 4 finished with values: [1.9724491180483352, 0.7054624899917451] and parameters: {'top_n': 4, 'n_estimators': 400, 'max_depth': 6, 'min_samples_leaf': 16, 'split_leaf_multiplier': 2, 'max_features': 'sqrt'}.
[reduced trial 005] N=05 RMST=2.6495 C=0.7067 params={'n_estimators': 400, 'max_depth': 6, 'min_samples_leaf': 16, 'min_samples_split': 32, 'max_features': 'sqrt'}
[I 2026-08-22 17:17:07,841] Trial 5 finished with values: [2.6494710610142604, 0.7067162372685688] and parameters: {'top_n': 5, 'n_estimators': 400, 'max_depth': 6, 'min_samples_leaf': 16, 'split_leaf_multiplier': 2, 'max_features': 'sqrt'}.
[reduced trial 006] N=06 RMST=5.6860 C=0.7069 params={'n_estimators': 400, 'max_depth': 6, 'min_samples_leaf': 16, 'min_samples_split': 32, 'max_features': 'sqrt'}
[I 2026-08-22 17:17:09,844] Trial 6 finished with values: [5.686031473649878, 0.7068620940062191] and parameters: {'top_n': 6, 'n_estimators': 400, 'max_depth': 6, 'min_samples_leaf': 16, 'split_leaf_multiplier': 2, 'max_features': 'sqrt'}.
[reduced trial 007] N=07 RMST=4.1060 C=0.7079 params={'n_estimators': 400, 'max_depth': 6, 'min_samples_leaf': 16, 'min_samples_split': 32, 'max_features': 'sqrt'}
[I 2026-08-22 17:17:11,902] Trial 7 finished with values: [4.105986740242861, 0.7079296411924254] and parameters: {'top_n': 7, 'n_estimators': 400, 'max_depth': 6, 'min_samples_leaf': 16, 'split_leaf_multiplier': 2, 'max_features': 'sqrt'}.
[reduced trial 008] N=08 RMST=-1.6461 C=0.7087 params={'n_estimators': 400, 'max_depth': 6, 'min_samples_leaf': 16, 'min_samples_split': 32, 'max_features': 'sqrt'}
[I 2026-08-22 17:17:14,096] Trial 8 finished with values: [-1.6460966964073698, 0.7087303015820801] and parameters: {'top_n': 8, 'n_estimators': 400, 'max_depth': 6, 'min_samples_leaf': 16, 'split_leaf_multiplier': 2, 'max_features': 'sqrt'}.
[reduced trial 009] N=09 RMST=1.8830 C=0.7110 params={'n_estimators': 400, 'max_depth': 6, 'min_samples_leaf': 16, 'min_samples_split': 32, 'max_features': 'sqrt'}
[I 2026-08-22 17:17:16,186] Trial 9 finished with values: [1.8829768761243917, 0.7109522893301141] and parameters: {'top_n': 9, 'n_estimators': 400, 'max_depth': 6, 'min_samples_leaf': 16, 'split_leaf_multiplier': 2, 'max_features': 'sqrt'}.
[reduced trial 010] N=10 RMST=4.4954 C=0.7169 params={'n_estimators': 400, 'max_depth': 6, 'min_samples_leaf': 16, 'min_samples_split': 32, 'max_features': 'sqrt'}
[I 2026-08-22 17:17:18,348] Trial 10 finished with values: [4.495369978003572, 0.7169106922298703] and parameters: {'top_n': 10, 'n_estimators': 400, 'max_depth': 6, 'min_samples_leaf': 16, 'split_leaf_multiplier': 2, 'max_features': 'sqrt'}.
[reduced trial 011] N=11 RMST=-1.0235 C=0.7170 params={'n_estimators': 400, 'max_depth': 6, 'min_samples_leaf': 16, 'min_samples_split': 32, 'max_features': 'sqrt'}
[I 2026-08-22 17:17:20,492] Trial 11 finished with values: [-1.0235005081627861, 0.717019308949397] and parameters: {'top_n': 11, 'n_estimators': 400, 'max_depth': 6, 'min_samples_leaf': 16, 'split_leaf_multiplier': 2, 'max_features': 'sqrt'}.
[reduced trial 012] N=12 RMST=1.8171 C=0.7177 params={'n_estimators': 400, 'max_depth': 6, 'min_samples_leaf': 16, 'min_samples_split': 32, 'max_features': 'sqrt'}
[I 2026-08-22 17:17:22,648] Trial 12 finished with values: [1.817077503575027, 0.7176927326104632] and parameters: {'top_n': 12, 'n_estimators': 400, 'max_depth': 6, 'min_samples_leaf': 16, 'split_leaf_multiplier': 2, 'max_features': 'sqrt'}.
[reduced trial 013] N=13 RMST=2.0519 C=0.7189 params={'n_estimators': 400, 'max_depth': 6, 'min_samples_leaf': 16, 'min_samples_split': 32, 'max_features': 'sqrt'}
[I 2026-08-22 17:17:24,817] Trial 13 finished with values: [2.051926923220448, 0.718937169882756] and parameters: {'top_n': 13, 'n_estimators': 400, 'max_depth': 6, 'min_samples_leaf': 16, 'split_leaf_multiplier': 2, 'max_features': 'sqrt'}.
[reduced trial 014] N=14 RMST=0.5372 C=0.7204 params={'n_estimators': 400, 'max_depth': 6, 'min_samples_leaf': 16, 'min_samples_split': 32, 'max_features': 'sqrt'}
[I 2026-08-22 17:17:27,060] Trial 14 finished with values: [0.5371629367265992, 0.7204081505986333] and parameters: {'top_n': 14, 'n_estimators': 400, 'max_depth': 6, 'min_samples_leaf': 16, 'split_leaf_multiplier': 2, 'max_features': 'sqrt'}.
[reduced trial 015] N=15 RMST=2.3428 C=0.7215 params={'n_estimators': 400, 'max_depth': 6, 'min_samples_leaf': 16, 'min_samples_split': 32, 'max_features': 'sqrt'}
[I 2026-08-22 17:17:29,293] Trial 15 finished with values: [2.3427796774887035, 0.7214912144590577] and parameters: {'top_n': 15, 'n_estimators': 400, 'max_depth': 6, 'min_samples_leaf': 16, 'split_leaf_multiplier': 2, 'max_features': 'sqrt'}.
[reduced trial 016] N=16 RMST=2.1130 C=0.7215 params={'n_estimators': 400, 'max_depth': 6, 'min_samples_leaf': 16, 'min_samples_split': 32, 'max_features': 'sqrt'}
[I 2026-08-22 17:17:31,527] Trial 16 finished with values: [2.1130357660457113, 0.7215315578120248] and parameters: {'top_n': 16, 'n_estimators': 400, 'max_depth': 6, 'min_samples_leaf': 16, 'split_leaf_multiplier': 2, 'max_features': 'sqrt'}.
[reduced trial 017] N=17 RMST=-1.8822 C=0.7232 params={'n_estimators': 400, 'max_depth': 6, 'min_samples_leaf': 16, 'min_samples_split': 32, 'max_features': 'sqrt'}
[I 2026-08-22 17:17:33,893] Trial 17 finished with values: [-1.8821636846709158, 0.7232477019805483] and parameters: {'top_n': 17, 'n_estimators': 400, 'max_depth': 6, 'min_samples_leaf': 16, 'split_leaf_multiplier': 2, 'max_features': 'sqrt'}.
[reduced trial 018] N=18 RMST=2.1242 C=0.7248 params={'n_estimators': 400, 'max_depth': 6, 'min_samples_leaf': 16, 'min_samples_split': 32, 'max_features': 'sqrt'}
[I 2026-08-22 17:17:36,272] Trial 18 finished with values: [2.1241556801412558, 0.7247993694023598] and parameters: {'top_n': 18, 'n_estimators': 400, 'max_depth': 6, 'min_samples_leaf': 16, 'split_leaf_multiplier': 2, 'max_features': 'sqrt'}.
[reduced trial 019] N=19 RMST=4.1248 C=0.7217 params={'n_estimators': 400, 'max_depth': 6, 'min_samples_leaf': 16, 'min_samples_split': 32, 'max_features': 'sqrt'}
[I 2026-08-22 17:17:38,700] Trial 19 finished with values: [4.124758369622893, 0.7217301712420167] and parameters: {'top_n': 19, 'n_estimators': 400, 'max_depth': 6, 'min_samples_leaf': 16, 'split_leaf_multiplier': 2, 'max_features': 'sqrt'}.
[reduced trial 020] N=20 RMST=3.7523 C=0.7229 params={'n_estimators': 400, 'max_depth': 6, 'min_samples_leaf': 16, 'min_samples_split': 32, 'max_features': 'sqrt'}
[I 2026-08-22 17:17:41,130] Trial 20 finished with values: [3.7522874978401872, 0.7228784051341571] and parameters: {'top_n': 20, 'n_estimators': 400, 'max_depth': 6, 'min_samples_leaf': 16, 'split_leaf_multiplier': 2, 'max_features': 'sqrt'}.
[reduced trial 021] N=21 RMST=0.0643 C=0.7241 params={'n_estimators': 400, 'max_depth': 6, 'min_samples_leaf': 16, 'min_samples_split': 32, 'max_features': 'sqrt'}
[I 2026-08-22 17:17:43,563] Trial 21 finished with values: [0.06428644897417131, 0.7241321524109808] and parameters: {'top_n': 21, 'n_estimators': 400, 'max_depth': 6, 'min_samples_leaf': 16, 'split_leaf_multiplier': 2, 'max_features': 'sqrt'}.
[reduced trial 022] N=22 RMST=-1.1561 C=0.7218 params={'n_estimators': 400, 'max_depth': 6, 'min_samples_leaf': 16, 'min_samples_split': 32, 'max_features': 'sqrt'}
[I 2026-08-22 17:17:45,981] Trial 22 finished with values: [-1.156112094967958, 0.7217705145949838] and parameters: {'top_n': 22, 'n_estimators': 400, 'max_depth': 6, 'min_samples_leaf': 16, 'split_leaf_multiplier': 2, 'max_features': 'sqrt'}.
[reduced trial 023] N=23 RMST=-0.3258 C=0.7227 params={'n_estimators': 400, 'max_depth': 6, 'min_samples_leaf': 16, 'min_samples_split': 32, 'max_features': 'sqrt'}
[I 2026-08-22 17:17:48,444] Trial 23 finished with values: [-0.3257541258625892, 0.7226891017086962] and parameters: {'top_n': 23, 'n_estimators': 400, 'max_depth': 6, 'min_samples_leaf': 16, 'split_leaf_multiplier': 2, 'max_features': 'sqrt'}.
[reduced trial 024] N=24 RMST=0.4828 C=0.7203 params={'n_estimators': 400, 'max_depth': 6, 'min_samples_leaf': 16, 'min_samples_split': 32, 'max_features': 'sqrt'}
[I 2026-08-22 17:17:50,915] Trial 24 finished with values: [0.4828423082894759, 0.7203367738972299] and parameters: {'top_n': 24, 'n_estimators': 400, 'max_depth': 6, 'min_samples_leaf': 16, 'split_leaf_multiplier': 2, 'max_features': 'sqrt'}.
[reduced trial 025] N=25 RMST=1.6633 C=0.7196 params={'n_estimators': 400, 'max_depth': 6, 'min_samples_leaf': 16, 'min_samples_split': 32, 'max_features': 'sqrt'}
[I 2026-08-22 17:17:53,425] Trial 25 finished with values: [1.6633119841037753, 0.7195733535256987] and parameters: {'top_n': 25, 'n_estimators': 400, 'max_depth': 6, 'min_samples_leaf': 16, 'split_leaf_multiplier': 2, 'max_features': 'sqrt'}.
[reduced trial 026] N=26 RMST=4.8318 C=0.7221 params={'n_estimators': 400, 'max_depth': 6, 'min_samples_leaf': 16, 'min_samples_split': 32, 'max_features': 'sqrt'}
[I 2026-08-22 17:17:55,994] Trial 26 finished with values: [4.8318228715374625, 0.7221118814277823] and parameters: {'top_n': 26, 'n_estimators': 400, 'max_depth': 6, 'min_samples_leaf': 16, 'split_leaf_multiplier': 2, 'max_features': 'sqrt'}.
[reduced trial 027] N=27 RMST=2.0185 C=0.7208 params={'n_estimators': 400, 'max_depth': 6, 'min_samples_leaf': 16, 'min_samples_split': 32, 'max_features': 'sqrt'}
[I 2026-08-22 17:17:58,520] Trial 27 finished with values: [2.018543224769108, 0.7207712407753372] and parameters: {'top_n': 27, 'n_estimators': 400, 'max_depth': 6, 'min_samples_leaf': 16, 'split_leaf_multiplier': 2, 'max_features': 'sqrt'}.
[reduced trial 028] N=28 RMST=2.1045 C=0.7205 params={'n_estimators': 400, 'max_depth': 6, 'min_samples_leaf': 16, 'min_samples_split': 32, 'max_features': 'sqrt'}
[I 2026-08-22 17:18:01,046] Trial 28 finished with values: [2.104463139160063, 0.7204671139606621] and parameters: {'top_n': 28, 'n_estimators': 400, 'max_depth': 6, 'min_samples_leaf': 16, 'split_leaf_multiplier': 2, 'max_features': 'sqrt'}.
[reduced trial 029] N=29 RMST=2.4699 C=0.7203 params={'n_estimators': 400, 'max_depth': 6, 'min_samples_leaf': 16, 'min_samples_split': 32, 'max_features': 'sqrt'}
[I 2026-08-22 17:18:03,569] Trial 29 finished with values: [2.469939179438524, 0.7203212572230119] and parameters: {'top_n': 29, 'n_estimators': 400, 'max_depth': 6, 'min_samples_leaf': 16, 'split_leaf_multiplier': 2, 'max_features': 'sqrt'}.
[reduced trial 030] N=30 RMST=1.5898 C=0.7174 params={'n_estimators': 400, 'max_depth': 6, 'min_samples_leaf': 16, 'min_samples_split': 32, 'max_features': 'sqrt'}
[I 2026-08-22 17:18:06,278] Trial 30 finished with values: [1.5897750546122837, 0.7173761924564137] and parameters: {'top_n': 30, 'n_estimators': 400, 'max_depth': 6, 'min_samples_leaf': 16, 'split_leaf_multiplier': 2, 'max_features': 'sqrt'}.
[reduced trial 031] N=31 RMST=-0.7353 C=0.7176 params={'n_estimators': 400, 'max_depth': 6, 'min_samples_leaf': 16, 'min_samples_split': 32, 'max_features': 'sqrt'}
[I 2026-08-22 17:18:09,001] Trial 31 finished with values: [-0.7353143358844618, 0.717562392547031] and parameters: {'top_n': 31, 'n_estimators': 400, 'max_depth': 6, 'min_samples_leaf': 16, 'split_leaf_multiplier': 2, 'max_features': 'sqrt'}.
[reduced trial 032] N=32 RMST=1.3223 C=0.7174 params={'n_estimators': 400, 'max_depth': 6, 'min_samples_leaf': 16, 'min_samples_split': 32, 'max_features': 'sqrt'}
[I 2026-08-22 17:18:11,762] Trial 32 finished with values: [1.3223338470064687, 0.7174444658229734] and parameters: {'top_n': 32, 'n_estimators': 400, 'max_depth': 6, 'min_samples_leaf': 16, 'split_leaf_multiplier': 2, 'max_features': 'sqrt'}.
[reduced trial 033] N=03 RMST=1.2535 C=0.6953 params={'n_estimators': 400, 'max_depth': 4, 'min_samples_leaf': 32, 'min_samples_split': 96, 'max_features': 0.25}
[I 2026-08-22 17:18:13,740] Trial 33 finished with values: [1.2535293803403746, 0.6953269983924726] and parameters: {'top_n': 3, 'n_estimators': 400, 'max_depth': 4, 'min_samples_leaf': 32, 'split_leaf_multiplier': 3, 'max_features': 0.25}.
[reduced trial 034] N=07 RMST=4.2863 C=0.7124 params={'n_estimators': 400, 'max_depth': 8, 'min_samples_leaf': 8, 'min_samples_split': 16, 'max_features': 'sqrt'}
[I 2026-08-22 17:18:15,854] Trial 34 finished with values: [4.286309128354813, 0.7123829266930243] and parameters: {'top_n': 7, 'n_estimators': 400, 'max_depth': 8, 'min_samples_leaf': 8, 'split_leaf_multiplier': 2, 'max_features': 'sqrt'}.
[reduced trial 035] N=00 RMST=3.1650 C=0.6830 params={'n_estimators': 600, 'max_depth': 6, 'min_samples_leaf': 16, 'min_samples_split': 32, 'max_features': 'sqrt'}
[I 2026-08-22 17:18:18,146] Trial 35 finished with values: [3.1650041141702276, 0.6830036557284458] and parameters: {'top_n': 0, 'n_estimators': 600, 'max_depth': 6, 'min_samples_leaf': 16, 'split_leaf_multiplier': 2, 'max_features': 'sqrt'}.
[reduced trial 036] N=09 RMST=1.2736 C=0.7053 params={'n_estimators': 400, 'max_depth': 6, 'min_samples_leaf': 32, 'min_samples_split': 96, 'max_features': 'sqrt'}
[I 2026-08-22 17:18:20,272] Trial 36 finished with values: [1.2736456505262883, 0.7053383565980003] and parameters: {'top_n': 9, 'n_estimators': 400, 'max_depth': 6, 'min_samples_leaf': 32, 'split_leaf_multiplier': 3, 'max_features': 'sqrt'}.
[reduced trial 037] N=06 RMST=1.2203 C=0.7067 params={'n_estimators': 200, 'max_depth': 6, 'min_samples_leaf': 16, 'min_samples_split': 32, 'max_features': 'sqrt'}
[I 2026-08-22 17:18:21,765] Trial 37 finished with values: [1.220340599186076, 0.706672790580758] and parameters: {'top_n': 6, 'n_estimators': 200, 'max_depth': 6, 'min_samples_leaf': 16, 'split_leaf_multiplier': 2, 'max_features': 'sqrt'}.
[reduced trial 038] N=03 RMST=2.1928 C=0.6989 params={'n_estimators': 400, 'max_depth': 8, 'min_samples_leaf': 16, 'min_samples_split': 32, 'max_features': 0.25}
[I 2026-08-22 17:18:23,642] Trial 38 finished with values: [2.192815162190802, 0.6988648001142027] and parameters: {'top_n': 3, 'n_estimators': 400, 'max_depth': 8, 'min_samples_leaf': 16, 'split_leaf_multiplier': 2, 'max_features': 0.25}.
[reduced trial 039] N=28 RMST=0.2183 C=0.7051 params={'n_estimators': 200, 'max_depth': 8, 'min_samples_leaf': 32, 'min_samples_split': 96, 'max_features': 0.25}
[I 2026-08-22 17:18:25,486] Trial 39 finished with values: [0.21834611561134748, 0.705142846502852] and parameters: {'top_n': 28, 'n_estimators': 200, 'max_depth': 8, 'min_samples_leaf': 32, 'split_leaf_multiplier': 3, 'max_features': 0.25}.
[reduced trial 040] N=23 RMST=-0.3258 C=0.7227 params={'n_estimators': 400, 'max_depth': 6, 'min_samples_leaf': 16, 'min_samples_split': 32, 'max_features': 'sqrt'}
