[I 2026-08-22 17:18:28,005] Trial 40 finished with values: [-0.3257541258625892, 0.7226891017086962] and parameters: {'top_n': 23, 'n_estimators': 400, 'max_depth': 6, 'min_samples_leaf': 16, 'split_leaf_multiplier': 2, 'max_features': 'sqrt'}.
[reduced trial 041] N=21 RMST=1.0615 C=0.7244 params={'n_estimators': 200, 'max_depth': 8, 'min_samples_leaf': 16, 'min_samples_split': 48, 'max_features': 'sqrt'}
[I 2026-08-22 17:18:29,729] Trial 41 finished with values: [1.0614585281043982, 0.7244114525469069] and parameters: {'top_n': 21, 'n_estimators': 200, 'max_depth': 8, 'min_samples_leaf': 16, 'split_leaf_multiplier': 3, 'max_features': 'sqrt'}.
[reduced trial 042] N=24 RMST=0.5532 C=0.7200 params={'n_estimators': 600, 'max_depth': 6, 'min_samples_leaf': 16, 'min_samples_split': 48, 'max_features': 'sqrt'}
[I 2026-08-22 17:18:33,054] Trial 42 finished with values: [0.5531560944914903, 0.7199985103992751] and parameters: {'top_n': 24, 'n_estimators': 600, 'max_depth': 6, 'min_samples_leaf': 16, 'split_leaf_multiplier': 3, 'max_features': 'sqrt'}.
[reduced trial 043] N=27 RMST=0.8667 C=0.7172 params={'n_estimators': 200, 'max_depth': 4, 'min_samples_leaf': 16, 'min_samples_split': 32, 'max_features': 'log2'}
[I 2026-08-22 17:18:34,625] Trial 43 finished with values: [0.8667412245027775, 0.7171899923657963] and parameters: {'top_n': 27, 'n_estimators': 200, 'max_depth': 4, 'min_samples_leaf': 16, 'split_leaf_multiplier': 2, 'max_features': 'log2'}.
[reduced trial 044] N=14 RMST=-0.3927 C=0.7193 params={'n_estimators': 600, 'max_depth': 6, 'min_samples_leaf': 8, 'min_samples_split': 24, 'max_features': 'sqrt'}
[I 2026-08-22 17:18:37,555] Trial 44 finished with values: [-0.3927378483314584, 0.7192568133716492] and parameters: {'top_n': 14, 'n_estimators': 600, 'max_depth': 6, 'min_samples_leaf': 8, 'split_leaf_multiplier': 3, 'max_features': 'sqrt'}.
[reduced trial 045] N=32 RMST=-3.7917 C=0.7151 params={'n_estimators': 400, 'max_depth': 4, 'min_samples_leaf': 8, 'min_samples_split': 16, 'max_features': 'sqrt'}
[I 2026-08-22 17:18:40,258] Trial 45 finished with values: [-3.79168377143672, 0.7150548979933837] and parameters: {'top_n': 32, 'n_estimators': 400, 'max_depth': 4, 'min_samples_leaf': 8, 'split_leaf_multiplier': 2, 'max_features': 'sqrt'}.
[reduced trial 046] N=27 RMST=0.6033 C=0.7151 params={'n_estimators': 400, 'max_depth': 4, 'min_samples_leaf': 16, 'min_samples_split': 32, 'max_features': 0.25}
[I 2026-08-22 17:18:43,212] Trial 46 finished with values: [0.603290692658716, 0.7150611046630709] and parameters: {'top_n': 27, 'n_estimators': 400, 'max_depth': 4, 'min_samples_leaf': 16, 'split_leaf_multiplier': 2, 'max_features': 0.25}.
[reduced trial 047] N=22 RMST=-0.8077 C=0.7220 params={'n_estimators': 400, 'max_depth': 8, 'min_samples_leaf': 16, 'min_samples_split': 48, 'max_features': 'log2'}
[I 2026-08-22 17:18:45,653] Trial 47 finished with values: [-0.8076614898794277, 0.7219970580385683] and parameters: {'top_n': 22, 'n_estimators': 400, 'max_depth': 8, 'min_samples_leaf': 16, 'split_leaf_multiplier': 3, 'max_features': 'log2'}.
[reduced trial 048] N=00 RMST=3.2370 C=0.6845 params={'n_estimators': 600, 'max_depth': 8, 'min_samples_leaf': 8, 'min_samples_split': 24, 'max_features': 0.25}
